title,date,source,content,link
A performance evaluation of drug response prediction models for individual drugs - Nature.com,2023-07-24 07:00:00,Nature.com,A performance evaluation of drug response prediction models for individual drugsnbspnbspNature.com,https://news.google.com/rss/articles/CBMiX0FVX3lxTFBCdzdMTGY2cWFobWNiV09LdGhRN21lZWJXaVM0eUFpVDVYYU1WVnpkRXgyS3VxX0E2VFoybGd1T0RNYnZ2SFEtaHZ3SUE3OEZ0d2d2T0ZZRkZQRHlza1NJ?oc=5
Machine learning and computer vision allow study of animal behavior without markers - Phys.org,2023-07-24 07:00:00,Phys.org,Machine learning and computer vision allow study of animal behavior without markersnbspnbspPhys.org,https://news.google.com/rss/articles/CBMifkFVX3lxTE9sWnM3UlFFY2lRTXlTcjQ5Mnltd3dWenYxMHZxbUllb05zNHlWeXZJTi13WjJCNUVJRlhKd3czZ3FMeVFxVnYzWUMzdVJuYmFVT2NRTFVJSUxyOGZjU3h6VGg5d05IRW1ZdWJpOHdvT3lhZGtuYVREbmx5RnFaUdIBfEFVX3lxTE5KbU05QTlnS2RsZUtDSDAtZ1NuNWVWT2lDTGx1RWhESlhQY0NFWHVqSzIycWhZX1ZyTTVQR1gzclMzcnpqcmpfSWEtUkJwdm5FNnhhTzBZSHZCQ0JyNEdNYzRYbnhMOHRRUVhuQnd4SVRiV25wY2JGWGZONkQ?oc=5
Annotated dataset for deep-learning-based bacterial colony detection - Scientific Data - Nature.com,2023-07-28 07:00:00,Nature.com,Annotated dataset for deeplearningbased bacterial colony detection Scientific DatanbspnbspNature.com,https://news.google.com/rss/articles/CBMiX0FVX3lxTE1VN3QtbTdLU0ljaHZMeDFzVFJTLV9oQUw2OUxLTWl5UkZxeGJKNjRWUnpPMHVwUHNZaFpqV0MwXzJhZVRCMjBKbFZvSjN4cEFPWm82VnZiZHlVSUgxVGVJ?oc=5
ICML 2023 - Microsoft Research - Microsoft,2023-07-23 07:00:00,Microsoft,ICML 2023 Microsoft ResearchnbspnbspMicrosoft,https://news.google.com/rss/articles/CBMiaEFVX3lxTE4yb0NHY0EyZnpBc0tVTlAyVjJ4UXpvOG5nVDI1YjViWjF3QVluajFMZ0NuOWRoTHUtTjFHajF4Ylgtd3V1WlRUUGVJYmVVODVwZTlLV2oxOVJOV3A3cGctWE5DLXgzZnBT?oc=5
Upscaling methane fluxes from peatlands across a drainage gradient in Ireland using PlanetScope imagery and machine learning tools | Scientific Reports - Nature.com,2023-07-25 07:00:00,Nature.com,Upscaling methane fluxes from peatlands across a drainage gradient in Ireland using PlanetScope imagery and machine learning tools Scientific ReportsnbspnbspNature.com,https://news.google.com/rss/articles/CBMiX0FVX3lxTE15TlUxWFhNQjFRZkdYbzNpZGJGMWVtQy1rc0xqRUpmRjZjSElWVWVOcGstdlNXR1liU24zaERpX3JKVEZYR3dqWHIxSnJ0SmRZZHFzYXhXNk0wTXZjLWFF?oc=5
AWS Reaffirms its Commitment to Responsible Generative AI | Amazon Web Services - AWS Blog,2023-07-25 07:00:00,AWS Blog,AWS Reaffirms its Commitment to Responsible Generative AI Amazon Web ServicesnbspnbspAWS Blog,https://news.google.com/rss/articles/CBMipwFBVV95cUxNREFmTjZwWW9QVnVXQU1UMU94elFNWVQ3aDV2OWhkci1UM3FpUnBIWEVrYjg1V0ZsdmxEU3dTZXVWcG5Ya2RTTG0zYl94Rk9VcVo2YWxCeHZtQjBRUHlfUEphOHBxRTZRWS1WWGZIR0RHWGZZSktzWWNMdHNtRGdGbk14Tlg3d1hvU3ROMmMxTDd0MS10OWFTQlRpRV9VM1dHeEFDWl9Lcw?oc=5
Micro SleepNet: efficient deep learning model for mobile terminal real-time sleep staging - Frontiers,2023-07-27 07:00:00,Frontiers,Micro SleepNet efficient deep learning model for mobile terminal realtime sleep stagingnbspnbspFrontiers,https://news.google.com/rss/articles/CBMilAFBVV95cUxQU3g4ZkpoQXJ6RTNSUGQtR1V6N2N3NmpCRk9oSEFoeUpmVGRIZnJjRVJLSmFuemlNZzEwUmdlSnBRWlZOYWw1Um1NVy0xd3Y5dHpHVHlKVlpWOUJfc2hzeDIwMTlWTUVBWm5jUG9URkh3SldKU0NGNm9NYmZlbmtIc01iZ2JlSHVVN29wRXllUkVEX2tI?oc=5
Machine learning improves genome quality prediction across the microbial tree of life - Nature.com,2023-07-27 07:00:00,Nature.com,Machine learning improves genome quality prediction across the microbial tree of lifenbspnbspNature.com,https://news.google.com/rss/articles/CBMiX0FVX3lxTE12eWlWNk5EX3VUY2JYa0tuOERzQ1otT3BNV3luaVowaHlTeC1Ya3VqVi02M1hQU0lPbVE2aHdzUmlsM1RtQnJmcTRzczZIT00zS1N4VE8xNmFmeUVXMU1r?oc=5
Unleashing a new era of productivity in investment banking through the power of generative AI - Deloitte,2023-07-27 07:00:00,Deloitte,Unleashing a new era of productivity in investment banking through the power of generative AInbspnbspDeloitte,https://news.google.com/rss/articles/CBMi6gFBVV95cUxNTzFoWFNhNXRJbnlFeV9ZMFZZbElIb1k2YUN2azQyZWdNUWttVE5WNUYwVHhmMXR4dlhoczB0eW56ZHdUTEVCRmtISm9KWnBYZzB2NHFGTWxOWk5aQktpX2RPYUVDVEt6NTJjcUs2b3B6ZFVzWVlRc05YSGoyUDVHcWVqNW9VTlVHNl85cy1EUTFhWDAxcExLQ3lxUnBsaHU4WUswOFRSWEFjT1ZBbTZWOWVyc2FLOGRRWmltU1hsVzJuQUZIZGZLU0JkMVVVdEJ2VVhRSUhzVnFYS0lzMTRiblowM1dhbGt5Ync?oc=5
LLNL Researchers Harness Machine Learning for Advanced Simulations of Water Structure in Carbon Nanotubes - HPCwire,2023-07-25 07:00:00,HPCwire,LLNL Researchers Harness Machine Learning for Advanced Simulations of Water Structure in Carbon NanotubesnbspnbspHPCwire,https://news.google.com/rss/articles/CBMi2wFBVV95cUxPbTJ0SXhhY0ZQVnBDZktxeUVNVDRrRXE4dUtSNG1kSEFlTUtfbG5YaGxabHdyRVlkVzlmNzN4dmxpRU9LNkRMUV8xbUthRkp3Vk5rVFFTejhnbnlGMXJwLWdSSlNRbDRsY09VcXNvOVAzSFh2cWFKelRwZGJqaFFnMGF6MVRvZW9neDlpSjBlNmRxTFVmZnF2YktGdUJGMUZvNDVXaURRT1lXRWhvMmZDdldqN1VuUnhnZ3pKcjZXV0pNUEQ4OElMaWM5TnpIV20zaWhrNVNCdWlGdlE?oc=5
USC at the International Conference on Machine Learning (ICML) - USC Viterbi School of Engineering,2023-07-25 07:00:00,USC Viterbi School of Engineering,USC at the International Conference on Machine Learning ICMLnbspnbspUSC Viterbi School of Engineering,https://news.google.com/rss/articles/CBMipwFBVV95cUxPSG1jLTJveEpRMnNNVFN0ZkJRWVhTaDJNTnlENEdoX2NHR3NJNUtjZnpCSW52SEtPNGZfMDhoeGI4TGRsbzlUaV9aR1NDUWdIREZja3RNd2NoNmZHVjluU251SjNnNzJQbDNlZnczODBGRkxvMm9GRnNYek82U2MydjRoelpidU5tT2U1QWRIQTZDUUJYSTJIRFNvS1dreERvTnYta0lMWQ?oc=5
Computer system based on light could jumpstart power of ChatGPT-type machine-learning programs - Tech Xplore,2023-07-28 07:00:00,Tech Xplore,Computer system based on light could jumpstart power of ChatGPTtype machinelearning programsnbspnbspTech Xplore,https://news.google.com/rss/articles/CBMilwFBVV95cUxPVm9pa0N1dmpxVi1NN2RRc29ncUV0QUgzb3VULVQzVkNmU3ZZcFUwazJ0Q0drVUZ6czQtT1RDb3BCcEw5VnJlem4xTWxYcVpBcmpxUlVlODJ5ajUxZHVaQU10elowTlBEaXp3bnJZd3R3ZDQxUktCQVNoaGc0am52ZXlnZUJ5bEhLT2MteEdkcW9lQ1NxMHh3?oc=5
AI and machine learning cybersecurity startup Protect AI raises $35M - SiliconANGLE News,2023-07-26 07:00:00,SiliconANGLE News,AI and machine learning cybersecurity startup Protect AI raises 35MnbspnbspSiliconANGLE News,https://news.google.com/rss/articles/CBMiogFBVV95cUxNSGZtLXpfVl9NREpaSEdQTkVWYldjVmktYzI2TzNIUXBCVEE1VTRUbGtWTEdnUy1FblotWFY1U3JXRXkxakZVTUVaR2cyME1fMGYySmVVZDdlcENYWFRzV2JsZFpLT212anhoRTlBUkNTVE9qMFRWWmIwMUR4VnI5RzZwYXBGZTdBT1NYUjgwQThqV0RqOXprZTJmVW5PQl9uTmc?oc=5
What is generative AI? An AWS VP explains image generators & more - About Amazon,2023-07-25 07:00:00,About Amazon,What is generative AI An AWS VP explains image generators morenbspnbspAbout Amazon,https://news.google.com/rss/articles/CBMickFVX3lxTE16Z3RQMzNGS1VOTE9KVTBwNVFWTkpESzNrY083Y3laTWFEZkg5WjVQbnBBWDBpenNVX25uLXlGLVJyVExiN2JWb2JPeTE2aHpETjBMZXhJQVk0SkpRcEkzcU9DTkhjaEpHRHpMYkhMbnJFdw?oc=5
Supercomputing for Superconductors - Georgia Tech College of Engineering,2023-07-24 07:00:00,Georgia Tech College of Engineering,Supercomputing for SuperconductorsnbspnbspGeorgia Tech College of Engineering,https://news.google.com/rss/articles/CBMidEFVX3lxTFBpZ1Fpb1RPM2JaRzY0QkVteHN3UWN6TUNIU1NwMzU4LWE0RWtTejJ0RnI1ejBTQll0bG9Rem52aGU0alRxRGM0QW5TNFdnUThWdF92ajBrQmxNVFRQX0h2dTRwR3VvWFk4YU9FMkFGYWNVeHc2?oc=5
"$424K grant to better predict weather, climate through machine learning, AI - University of Hawaii System",2023-07-24 07:00:00,University of Hawaii System,"424K grant to better predict weather, climate through machine learning, AInbspnbspUniversity of Hawaii System",https://news.google.com/rss/articles/CBMie0FVX3lxTFBVWmhQaUpLMWVRd1h1Wi02bTBEbkpldldJcGVEM3Fub2FWODBWaXNudXVFTlpZSGlQMXQwaHFKd2xoVzlCNHZ3RXNQYzQ3cTVMOVBRcXAxWm5oMlUxelo2a2k4alBaTzBZVDZnYVN1RGtQV3l6M0dIS0RuTQ?oc=5
The predictive value of machine learning and nomograms for lymph node metastasis of prostate cancer: a systematic review and meta-analysis - Nature.com,2023-07-24 07:00:00,Nature.com,The predictive value of machine learning and nomograms for lymph node metastasis of prostate cancer a systematic review and metaanalysisnbspnbspNature.com,https://news.google.com/rss/articles/CBMiX0FVX3lxTE1oSV9KS1FNWWVyQngtT1lJTHA4ODRzMzA1Vno1cmNfTmtDaFVSbFB6SUZNLVBmT2owZDhkRUFCaEZjWGdNb3VtSG1JdDFxRzZEczZiOGprSWxJeEx3dldr?oc=5
"Animations, and 3-D Models, and 3,000 Drawings: Inside Google’s Massive Machine-Learning Masterclass on Leonardo da Vinci - artnet News",2023-07-27 07:00:00,artnet News,"Animations, and 3D Models, and 3,000 Drawings Inside Googles Massive MachineLearning Masterclass on Leonardo da Vincinbspnbspartnet News",https://news.google.com/rss/articles/CBMijwFBVV95cUxPNDNkb2RSMEdwcmxHNHFQdU1XcS1WMVpHOEt4Um9Fd3FTaHhyWVYtbkx0UmxVWjY4bzNfUzk1ZkUwa1VlR2E5S1pqRDFBZUJNWWs3OXFCSHNVeEFWbmpRVTF4N0FIekZ1RjZfLUNiWjBUM2RKREZkVi1mX0E1WWFpVXp6NUR1UU50akdqTWhDVdIBlwFBVV95cUxPWEtqbE1SRjZzTDN3akpEWDJLLVNaZXdpb0thSDFTS2tWWU9uaXF4aXZOMXdpaVRITVdLVDQ0WmZuQmU5OE9weTZoRm5Pay1Pc1Z2VWpCOHJtT2hMZzRmcE1qenNZcEstajhYVG42WWdQdmNaaFp5amtUR1FMZWRQN01rV1ozYjBVeHBXcW5rX3dyelRZOWhF?oc=5
Protect AI raises $35M to expand its AI and machine learning security platform - VentureBeat,2023-07-26 07:00:00,VentureBeat,Protect AI raises 35M to expand its AI and machine learning security platformnbspnbspVentureBeat,https://news.google.com/rss/articles/CBMiqAFBVV95cUxPV3ZMQ0FtbkJ5TVlnSG9OVzhfdHVtWWxjOEJqcmxRRmpRTF91NE1IMk5kQnYzdTc4TG1jUFU5enFaeWk3R0R2ajNCSHIzdVd1U0pBQmZxMmlqVXZBZlk0c2pYTlZ6YU41dDg5WlhXU3NsSXgydmEwaWNFX3N3aWFvLTZzQ2pvMVZWeVVMamdaNEdqVHJtTS1YYUU2M2lwTUlaeVUtZ1hscno?oc=5
Performance of two complementary machine-learned potentials in modelling chemically complex systems - Nature.com,2023-07-25 07:00:00,Nature.com,Performance of two complementary machinelearned potentials in modelling chemically complex systemsnbspnbspNature.com,https://news.google.com/rss/articles/CBMiX0FVX3lxTE1JZGhYejFudVlYMWRFX3lTSUFJelZ1OHYzQTU2UGcyUGRlQXNiZGl1a2VSV2hhcGNTUk5JYURpX3VwSWpuOVVCVW1MTWNBWkhVNjZJYllGZWFnbTFWdVdN?oc=5
Machine Learning Approach Aids Source Rock Evaluation - Society of Petroleum Engineers (SPE),2023-07-24 07:00:00,Society of Petroleum Engineers (SPE),Machine Learning Approach Aids Source Rock EvaluationnbspnbspSociety of Petroleum Engineers SPE,https://news.google.com/rss/articles/CBMifkFVX3lxTE14LXMyM0p0TlBGc2trYjg3YWtTSXVEMlpPR3BiaFA0Rk13d1owOXVVd1c3U0pCSnpnV09kSFVnSk5ZS2czNll3M19EaWcxQ09HTXR3V0ZDNTFtSk42WVVaWGtxdzBqN2JFek5YSW1ZUnRvVzBucnY5dHJiMHM2dw?oc=5
AI-enhanced night-vision lets users see in the dark - Nature.com,2023-07-26 07:00:00,Nature.com,AIenhanced nightvision lets users see in the darknbspnbspNature.com,https://news.google.com/rss/articles/CBMiX0FVX3lxTE5RenJJREtnM1lGNjdyWGIxTDJJdUg1TGJ3UnkzZ3FfZDdUM0FIaGFDdE9RdzI4YTBkVktjMXVCZDktSHJveXFBRDlhOG83X04xNVFmVGJnbklWUkprUW1r?oc=5
Prediction of stability coefficient of open-pit mine slope based on artificial intelligence deep learning algorithm - Nature.com,2023-07-25 07:00:00,Nature.com,Prediction of stability coefficient of openpit mine slope based on artificial intelligence deep learning algorithmnbspnbspNature.com,https://news.google.com/rss/articles/CBMiX0FVX3lxTE9hWm50aXViT0w1M1RJVTVzNkwxN00tVFp6WmJETllSWU1LQkE3dFlhaHN0THNrQkU3QTI5RFUwMXlhZ2I3UUJvbWVMR1U5YnY4ckhWUGUyZ2xYOG9ldUNn?oc=5
Argonne and University of Chicago researchers improve management of electric vehicle charging through machine learning - Argonne National Laboratory,2023-07-24 07:00:00,Argonne National Laboratory,Argonne and University of Chicago researchers improve management of electric vehicle charging through machine learningnbspnbspArgonne National Laboratory,https://news.google.com/rss/articles/CBMivgFBVV95cUxQWWktS01hZ0V4SXFOM3hTU0ljVENxUHBWYzVnYkw2N2w4czFmQW5qRlZTN05PMV9Od0ZPZzljdVFHbjNlcUZHYmFjTzduZkZqb0NRSjRHRDR0WWhQc0Zkc1BnQWllVVFzcEZrdUU1NHJRZGlyMDNMS3BONE8tb09RelFJOGQ2NlBwcHZRY3VQWXl4bHAybWkyTXlQN3dWVUMzcUcwV1phR2o0WGZ5dG5UUG9YblExRUM2MWJ1Z2NR?oc=5
Top 10 Machine Learning Optimized Graphics Cards - hackernoon.com,2023-07-24 07:00:00,hackernoon.com,Top 10 Machine Learning Optimized Graphics Cardsnbspnbsphackernoon.com,https://news.google.com/rss/articles/CBMie0FVX3lxTE5BeWM3eGxscHp4OU9IUFpJMnZPOVRyN0JLUlptbUUyajFlamFjdU1sRE1xYWZwWmFWaWJrcFROdkdFcFhKTXpZNlktMjVKX05xZ1g4NDNtcUNKbmxWMzJCVGtvZUQ4UndnQ3hSWFZudzRaUjR5cTRYUGtLTQ?oc=5
The promise of zero-shot learning for alcohol image detection: comparison with a task-specific deep learning algorithm - Nature.com,2023-07-23 07:00:00,Nature.com,The promise of zeroshot learning for alcohol image detection comparison with a taskspecific deep learning algorithmnbspnbspNature.com,https://news.google.com/rss/articles/CBMiX0FVX3lxTE43dE55dlFoN3JUdjFqQl9kcmhNa21vRDVRNFRjT1ZHU1lkYUZablZ0eEFOelRtbkxxQm1YYkFDTmtVRS11bVdQcWxpLXZhc216NDZvSGp3VmZVMEJtOUpv?oc=5
"GETMusic Uses Machine Learning To Generate Music, Understands Tracks - Hackaday",2023-07-27 07:00:00,Hackaday,"GETMusic Uses Machine Learning To Generate Music, Understands TracksnbspnbspHackaday",https://news.google.com/rss/articles/CBMiogFBVV95cUxQSDYxZS1YUnZ3cWN6VE5sR25xSXp1a19QNGVkX01aM1pfanppVzlBY25kUWRvV21FLThUN2M0dm1uOENvSDE3UmlQam9fdGxqM2ZDcG96OGVfM2dRTmFWQnlWMVBLZDhxMURLbzBocGV5Z2J0Qzk4SFBnQnBjWnFtOXVWTWhOREZsT2lEdmRDdXJlc3BXMTBCRUhFc0FfM210eVE?oc=5
Netflix touts $900k AI jobs amid Hollywood strikes - BBC.com,2023-07-27 07:00:00,BBC.com,Netflix touts 900k AI jobs amid Hollywood strikesnbspnbspBBC.com,https://news.google.com/rss/articles/CBMiXkFVX3lxTE51VFVIN1dHd0tfVHJQWFRCa1Y5S2xSV1RPNC1ZbkVvcDkyTnBibHd6ZzFzUXZDWnhCOGtvT3dIZUdBWmhXdVBZU2RweHJiRFNYaHBsRGRTN2F1dm5HdXfSAWNBVV95cUxOSUUyNzZCVVowNUFFSkszdmlYSFEtcTNDVzUtR0xXdDRRbWpQdl9Va0ltV0UxcktSY0NuMnhkRnRmZG5iNmQyWF9ZazIzVzNQeEVEdnNPSVFnM0swaXg1bDFDT1k?oc=5
"What Graph Models, A Branch Of Machine Learning, Like To Learn - Forbes",2023-07-24 07:00:00,Forbes,"What Graph Models, A Branch Of Machine Learning, Like To LearnnbspnbspForbes",https://news.google.com/rss/articles/CBMipwFBVV95cUxNbEVVZ21NLUtVRVZSNUVVSDExU2J0bkwzblowV0kyZ0xlQVFvS3JrRWtIeGcybEI0b0FXNDZybnI2aW5CdFlVR2NwNjRMTE02VkNkLUlUZkdEN01lMWwwcUJQN19HMk81QTJnRW1GNHowR0prVzNRQ1czNm5GOHlCS1YyVmpTQ3JXbUxKcmUwX1lUZk9NdUIxR3U3UmRJbFlBU1R0bk5pMA?oc=5
breast cancer disparities using a machine-learning pipeline - Nature.com,2023-07-26 07:00:00,Nature.com,breast cancer disparities using a machinelearning pipelinenbspnbspNature.com,https://news.google.com/rss/articles/CBMiX0FVX3lxTE9DYnR1VTVwVTZHZXg2NDlwQjdTaEVmTkVsWGtLblFDQ3hmUFMxRUZEMjh2QVlwVXpGNm5KZURMTjY5bkZ0YjZtVFkwQVdncVotdU5sMnNRMEhjVEYtM2lF?oc=5
"Accelerating AI, machine learning in research - University of Cincinnati",2023-07-24 07:00:00,University of Cincinnati,"Accelerating AI, machine learning in researchnbspnbspUniversity of Cincinnati",https://news.google.com/rss/articles/CBMizwFBVV95cUxNa2NmMUlOSXZMcktXZG9sVjk0R1BBckRPeTlBaTYtbU00N2NDLXk4SW5XaDl2VnpNVGhfdzZ2ckxpb2wyXzkzdTZuNVNmVE04VmxyZ0wyVUNlUDAwb3hfVWtKdmZxTjBJaW94TVRXR0gzUXFTVlZ1b1RNcWVXaWxJMG9TYVhLVk5TR1BWY2VocEFnMlUxcWNpLXFybThwLVEtUzZuZWd6SlE0Sm8zSzVSLWlXZXdIMk41M2VNU29nMU1OVWRweWJDenp1bmhVYlU?oc=5
"Machine learning, incentives and telematics: New tools emerge to manage rising EV charging loads - Utility Dive",2023-07-26 07:00:00,Utility Dive,"Machine learning, incentives and telematics New tools emerge to manage rising EV charging loadsnbspnbspUtility Dive",https://news.google.com/rss/articles/CBMitAFBVV95cUxPelNNN19COGdwOFA2UWlldFZpUjBFUnF2Vm8ybnZQblBtRXA0Zm5rYXF6ZjRiU0Vkdm93RG9sdk1leUM1dmlNTWtWOEZEWWhXakp6T2ptV0hGbnNnenpjY0dBTFE4OS16b0Q1dUMxMHc1bWkxV0U0YzB1aVJrbDFKbnJuMzFQbFVUZFhDeEM0SWdsVXJHYXFJaWt0M3MzZERMd1hwZXlwczVnbGlFNk9oTzUyaXc?oc=5
Novel Machine Learning Blood Test Detects Cancers with Genome-Wide Mutations in Single Molecules of Cell-Free DNA - Johns Hopkins Medicine,2023-07-27 07:00:00,Johns Hopkins Medicine,Novel Machine Learning Blood Test Detects Cancers with GenomeWide Mutations in Single Molecules of CellFree DNAnbspnbspJohns Hopkins Medicine,https://news.google.com/rss/articles/CBMijgJBVV95cUxON0JmZFVUZ3IxSHBsc3pNU1VwV01MSDBJYkFrWmlhSktVb3VINDUwMEMwYXM2WTNqVDhqN00tWUxuT0l0bDZIdld2cTN5cFVnOWhMOVVXLUpSMWpEbERoUk9FRFFxUnpHdTlrbmRkZ1JEX0V4TURCQmk3X3lvU1ZEd3RyU3N4ZXJ4U2o2aTExclFlNVlEcWRtLU9TaVItS3FRV1hfWWFUMHRrTVdyMS1TS1dIV0VIMldXVGMyVTJ1SFFKLVBSa09yWGVqMlBnMmlidlNfa3JfNnl6R3BMUzhRakY4WHBQb0FGVDdsT0pvMnZqVzF6Zi01clFvNGtGa3AweDRjMTJWMXBtYzNBTEE?oc=5
Prediction of the risk of cytopenia in hospitalized HIV/AIDS patients using machine learning methods based on electronic medical records - Frontiers,2023-07-28 07:00:00,Frontiers,Prediction of the risk of cytopenia in hospitalized HIVAIDS patients using machine learning methods based on electronic medical recordsnbspnbspFrontiers,https://news.google.com/rss/articles/CBMilgFBVV95cUxNQXBZaFJhNnhQVm5rUTZkTHBDS190WkN6anlleE9vODhDUmVCRnV1VElMR0FyaG05U0NRVGxLV2R5NkxJT1BRMkpLVGhoN3lKdV9XVmdiZGhxaVBITFJUM0htaW9uS3AzSnJpaUR2Nnljdko2c2VNTllOUV94OEdVOXJQeC1lNXNCUmFGS3J4d1pkUTRfRmc?oc=5
Machine learning enables discovery of DNA-stabilized silver nanoclusters - Phys.org,2023-07-25 07:00:00,Phys.org,Machine learning enables discovery of DNAstabilized silver nanoclustersnbspnbspPhys.org,https://news.google.com/rss/articles/CBMiigFBVV95cUxNM1ppWWg2YVpaRkxKNmtBbTY1bFhZUE5EcG8wT0tTTDdHNFM3eXIzdEY4UXBkaktpMXM4c3lpUFcwSzlxcUhRNzRSNWhrZmRMeW9sZEdSUTFTNUhMaVdRbUtwYjlJajRqeUZBemlZbGxlU3ZZbDV1STJhTEJsbWhEcDNLT0FKS0FUT0HSAYgBQVVfeXFMT2VRbno4LTBESkRBaVU5Z0ozTExUdXJJejhZanpqMVE4NDVLcUI1eDhfdUZ0WHVFWDVuLVhkNkJJMGVsYTFreExTekpsMW9VdjJlYXpFMWFpelpiVzFhdk1vMHZDRERHd0hZM2ZmU29iTC1YUDZabW1uRTBSdXFlUzJUd2dldDNxcA?oc=5
5. Use of AI-related technologies by U.S. businesses - Pew Research Center,2023-07-26 07:00:00,Pew Research Center,5. Use of AIrelated technologies by U.S. businessesnbspnbspPew Research Center,https://news.google.com/rss/articles/CBMipAFBVV95cUxPanJ2NWtNM0hzX2l6S19jN3JzOEdrY0ZySDlVMjl1S3Ezd2Mwa0hsd0VLbHBhZlhsVG1FZ0xtTXIweDBwZVZsWk1QZWNvbzMwbUZVSHc3MDN1Q1FjUFA5WDhuVkJIdUJmNm5WSmFZMTQtVDNzdkE1QlNzc0JnVmdmUW9FY3RRdzNHdkxxSTFKcW1LaTk1cWdsUmh3alEwMUVGTFlxSw?oc=5
Deep learning predicts patients outcome and mutations from digitized histology slides in gastrointestinal stromal tumor - Nature.com,2023-07-24 07:00:00,Nature.com,Deep learning predicts patients outcome and mutations from digitized histology slides in gastrointestinal stromal tumornbspnbspNature.com,https://news.google.com/rss/articles/CBMiX0FVX3lxTE9vSE5Qa21EWjNZLWd2REZNM29fb1VVYzhIc3NYbXJwdWhoRmQ5UmNlQzJBT3kxd3pLN1VsdGpJbWtHNk1KZmRIWWloV0dST2tiX1RGWEc5WmNiVkh6UUdZ?oc=5
Scikit-learn vs TensorFlow: A Detailed Comparison - Simplilearn,2023-07-24 07:00:00,Simplilearn,Scikitlearn vs TensorFlow A Detailed ComparisonnbspnbspSimplilearn,https://news.google.com/rss/articles/CBMib0FVX3lxTE5OZHNQbjdMRXdLb3hhaTlFSlVMMTMwQ2xmbXd5N0Fsbk9mODQ5QVByR0YwN3NLZEJaLWo3WS1ZN1c1S01DSjZNM3BJeHFTLUlfWkpMYVRxY09iMnl6amhkY21iT3JPS2t0V1dXTk9qdw?oc=5
"Netflix invests more than half a million dollars in machine learning role amid SAG, WGA strikes - KRON4",2023-07-26 07:00:00,KRON4,"Netflix invests more than half a million dollars in machine learning role amid SAG, WGA strikesnbspnbspKRON4",https://news.google.com/rss/articles/CBMivwFBVV95cUxObjljSE9ES0NJbXlZa1lOSFowS2x4QjBUcnpCdk0zOTlFeEhPRk1DZjNLaGU5UHlqMFNQWnJhNHpJUUpZaFBWRE5kVm9rNS1uSnk5ZFg4MmsyQjlNOXFOMDMyQ2FPLXc0eFp6M1BHVU1aRUc2T2xoSzdyeERIb3FYZzB6MWc1SDUyZW9nY2VoY1BiYlVxZWE0WFVwbUFWVEVXMmo2RXJNT04yUXM4cmUweld0cG9MLVU3Zy15dEc0Z9IBxAFBVV95cUxNQ3paeFRKYk5uUkNLR3hHWmhXdzZnVUZnQU5pYlVHaDlackVLa05WWFcwQmY0b3NBNW9rSnAzTHNGcHVkTzFYS0FRQzZVekdjNXpQUXJnWFV3emxzaVZfeVFORXpIZTlYM0VsQkw1OGZtbGdhOHdGSTk2ZDN1Ym5DS3Z2cGNaWHkya0VyUU1WUmVLVTBUUGR1YnFReE5ZMGdsWTd6cFBwbUJ3UGIwT3VCSnR0QXkxeV9FVHM2bEpFcnpNZjVL?oc=5
Which U.S. Workers Are More Exposed to AI on Their Jobs? - Pew Research Center,2023-07-26 07:00:00,Pew Research Center,Which U.S. Workers Are More Exposed to AI on Their JobsnbspnbspPew Research Center,https://news.google.com/rss/articles/CBMirAFBVV95cUxQX1k2RUYxM1F1QXkza0VQOHBSanpfVjhUQUt4enJzRkxJcUxfZ2tfMFZ1SHBvZVpNVHZRaW94NThNUXhnVnY1dzNMeTdndFRyamlHemM5TnRkSkplVkRCS2pqdWd3bWRlcmhIQUtxbV9LdkxRX2pfdExDTF9vYkhhbTBUSDJGTlppa0sxQU4zc3JmSlMzM00xb0p5YkY0Z3pKajVVbTdRTV9kTmZH?oc=5
Insights into modeling refractive index of ionic liquids using chemical structure-based machine learning methods - Nature.com,2023-07-24 07:00:00,Nature.com,Insights into modeling refractive index of ionic liquids using chemical structurebased machine learning methodsnbspnbspNature.com,https://news.google.com/rss/articles/CBMiX0FVX3lxTE5KeUMybDdwa0VkWmxsSU5GUUZyTWliZUczdmdLYzhUSTZCLXlZUWlsdFpOVUxzSmZ0N1d5TWMtX0lvV0kxbnBDSnhkZ2JKbFkxUUdFS09mVDJySUxLVldF?oc=5
Top FBI officials warn of ‘unparalleled’ threat from China and AI - CyberScoop,2023-07-26 07:00:00,CyberScoop,Top FBI officials warn of unparalleled threat from China and AInbspnbspCyberScoop,https://news.google.com/rss/articles/CBMibEFVX3lxTE8yYXNLVUo1TmF1bk9kLVhhZUtzd2NIaDEzdVd5ZVU1Z2NQVkxRNDVLR19NekFKdTJzcmZlX0hyUXVleVBLM1NrLXVQbGRFNkd2emlWS3duLWdZSkpMNHBUQmxndGhfeGkwVm14Mw?oc=5
Predicting lifespan-extending chemical compounds for C. elegans with machine learning - Medical Xpress,2023-07-26 07:00:00,Medical Xpress,Predicting lifespanextending chemical compounds for C. elegans with machine learningnbspnbspMedical Xpress,https://news.google.com/rss/articles/CBMingFBVV95cUxPR1V3eUtqaUtsUGwzMEtFNHphT3A1RjRVb3dGenA1WnZmVnlOTmd0MHl2dTRYblhFSlg2SzdxcGMyQVh5VlpnYlNoQTZJRDlvVUxxc0J5WVo2Vk14MjA0RjZtc1pEZU1sT3ZmNWxTdnd1TzNaem1wX3lUNW1EaG54NVpSN2kzRWV0MDRvQWxKVGk2eng2aDZhem9sR20xUQ?oc=5
Exploring the configuration space of elemental carbon with empirical and machine learned interatomic potentials - Nature.com,2023-07-27 07:00:00,Nature.com,Exploring the configuration space of elemental carbon with empirical and machine learned interatomic potentialsnbspnbspNature.com,https://news.google.com/rss/articles/CBMiX0FVX3lxTE44WGN4cElLTFNKVmdDRFNQVS1SYUV5YmdaOURja0tVUlBUMVdKTTlkR2RFQ242U3AwbTg3aE9zT2Q4bExOVy1YaWtaRG5KVlNxbTN0cklRbmpWbGx5RmVV?oc=5
Controlling the Solo12 quadruped robot with deep reinforcement learning - Nature.com,2023-07-24 07:00:00,Nature.com,Controlling the Solo12 quadruped robot with deep reinforcement learningnbspnbspNature.com,https://news.google.com/rss/articles/CBMiX0FVX3lxTE1nVlFObmdIVEVvWTl4RG92cnJzdWEwM1hsVVhsdGN1b3BjaFQ0Zm1TaTZ3Ymp0Z2o2ZEVJSmZvejg3N2ZlSmRKS3h6TW1zZHBXbjJtNjgyNkpNN0Q0MENB?oc=5
Resolution enhancement with a task-assisted GAN to guide optical nanoscopy image analysis and acquisition - Nature.com,2023-07-27 07:00:00,Nature.com,Resolution enhancement with a taskassisted GAN to guide optical nanoscopy image analysis and acquisitionnbspnbspNature.com,https://news.google.com/rss/articles/CBMiX0FVX3lxTE02M3YwdmhpWDFPNlZPX1BJLVA1aFZPbkxLVEZrWUY0OVVpMEc3cnRmTm1DWmdIZVQ5NHg0d0Z0Tk02R0dKMm9IY2h0QVVhVTkzRk1DOGU0eGtJNjlRU19F?oc=5
"Netflix Needs an AI Expert, Offers $900,000 Salary - PCMag",2023-07-26 07:00:00,PCMag,"Netflix Needs an AI Expert, Offers 900,000 SalarynbspnbspPCMag",https://news.google.com/rss/articles/CBMif0FVX3lxTE1LNzR5dFgwRnd5YXc0MTFvaGY2aWFKQk5jRW9HaElJaDJUS3ZNaDVqd3pFb3FyVU9vWnhfa21DR2ZjQUdoRGxYM1NUX2RESHl6eVF0WjVlNXZiaW1IeGJZWmN5blpQTnNySlZac3hjbTFVVVpJYlFKTWtVTmIwTUk?oc=5
How Machine Learning Could Aid the Design Process - Power & Motion,2023-07-26 07:00:00,Power & Motion,How Machine Learning Could Aid the Design ProcessnbspnbspPower Motion,https://news.google.com/rss/articles/CBMixAFBVV95cUxOQVRFNmhqQnZuUmctdU5pTW1sWWlwYnc4TlJVUEpoX2h4NVYzY0EyUWhtSmlpc1dXY3c2MGpiMmg5b0RnaDJPeGRibU8weG9ZVGdqZDlETDRxMEFfNHVWanJ2SndfbXN4Tm14dWMzdldOckRYMWdtanp5RnJCVjhlSU1pWkluYW5saXNsVG5vUmVhRFNSWkhDcGlBOFl0aEpvdU0xWXFEenZLeFdaMjN0cVZXMTAxa2J3a24zMDVNeTZmUEZC?oc=5
Use generative AI foundation models in VPC mode with no internet connectivity using Amazon SageMaker JumpStart - AWS Blog,2023-07-25 07:00:00,AWS Blog,Use generative AI foundation models in VPC mode with no internet connectivity using Amazon SageMaker JumpStartnbspnbspAWS Blog,https://news.google.com/rss/articles/CBMi7gFBVV95cUxOSFdPZEs0elRtMi0tdVBGTktGTlg5V29KNjg0WjVxSGtuczRqWTJuc1ZJR1BUaWotTF9nX29ScmppR1lyWFdwWlBub3k2VkV6Y0d1Sjc5amlwaXRJVkstZjJvbFFEMXByLVhSR0c4ZFlJX1JUUGpreXNuTkplbkQ4bVFWcXRDQS1IYzhmU3VaVHA1WnZvek5NUU8zazBlWXJxcTB5aEpHWjdCbzhjaFlrSExrZHRrZ09zaHNiU0cxUHNHTWF6OHY2WXdSbmQtS1FOenhUd04tNHd4aXRsSURCeTI0anZCSDNjSHpLVmdn?oc=5
New Graduate Course Available – Advanced Seminar in Learning Sciences: Machine Learning - Theory and Applications - McGill University,2023-07-26 07:00:00,McGill University,New Graduate Course Available Advanced Seminar in Learning Sciences Machine Learning Theory and ApplicationsnbspnbspMcGill University,https://news.google.com/rss/articles/CBMi3AFBVV95cUxNWnlfS21QaG54bjBPZS1LbTVUcHFFYnFzSkRwbks5LUZua04yTlVWa2JtSUxlUEIwS01iREF5U1BMa0UwZjFucjNKQjRQdzJSWGdXQ0M2T2Zvcm5rSjlLZEg5SE9JT1BFek1UZXpGZzJuWUFHME1EYnhuUFNHWTcwbjhSTnIweHQzYmc5YUZJUnNfOEEtM1R2TmhJQ1dHbGtNcEtqbW9JTGl1RXVTcDVwWk1ObmhGaTVJNjJXNTlmbm1UR21XR01yQlJQRy1LUEVTdDFOTVZTdWU3OWli?oc=5
"Top Databases for Artificial Intelligence, IoT, Deep Learning, Machine Learning, Data Science, and Other Software Applications - MarkTechPost",2023-07-23 07:00:00,MarkTechPost,"Top Databases for Artificial Intelligence, IoT, Deep Learning, Machine Learning, Data Science, and Other Software ApplicationsnbspnbspMarkTechPost",https://news.google.com/rss/articles/CBMi9AFBVV95cUxNQUxkNTF2N1MxWHFNNnlvZnJwV0poVjYwNlRQNWVwT3hKaDZleWNYd2dVYW5saDdpTzRsbDY1RW92MU1sSnJDYUJHdUZnVXUycWFKbkhEb0I4ZDhwMU1oMVBsQ0N4bDMzVzFJbU82cTJ3aGtmSUM5QlNKNW5lcXpjLXdVbms4V0xNSTVIM2szOU1HM2NLSUpNRERKSzZXRjc2Y3pLYUowTGp1VEV1ZGl0b3JNQ0ZkWmpDYzZhdHBya2x5bEE2dnNCNmFXU2hKNmVWeTh1VWR5UlFvMjdfSnZVSzUyMlVQZWJRRWY5WHBKTy1vMnYy0gH6AUFVX3lxTE5tS0gtMzBEUmpWMjkxbnVMaWFIMVY0QU1hUDlUWDFNRnRmSzlUV2dsODNobmdVV0NPRENqbWxHbEp0RkFQazctMXd3MU5pdm1aYUhDS3pQRlAyeE85aHBJemt1MjdmZFdGd1gyMnZSNGwxY1UtWjJMZHVRYUdDX1hudk5IZWNqaHZjb3IxXy14OFZ5UDVSOHV4UDJDdzVYTGRsNUpHODhaMWhBTmZOWF9WNUhTTklBV3pZN1NFREstUkc5eVo0eFhidGxLek1OUF9Fd1FnRUkxMUtEZ0ZZajBqOEI2YlFxdU9PMDdTbTQtdUdIZElDSXBJZ0E?oc=5
