title,date,source,content,link
Advice | Artificial Intelligence: A Graduate Student User’s Guide - The Chronicle of Higher Education,2023-07-25 07:00:00,The Chronicle of Higher Education,Advice Artificial Intelligence A Graduate Student Users GuidenbspnbspThe Chronicle of Higher Education,https://news.google.com/rss/articles/CBMikgFBVV95cUxPb2xocV9OcE5mczBNcjZqWm9hRlhUMVo3NVlvTE8xaExrYW9fVGdMelZhUEtZTjViU1dmSTdqbklyTHVzcnF0aW95WEQ4SEc1Q2JYZDJiNDBoTUd5NzVxZU5yOHQ4c1NzOWhsdjJyM0RfY0Z4cjFZNTBKVXBNcktpZE1MbkI1SWxVSzZzUUt0MXNPdw?oc=5
Head of UN digital agency discusses artificial intelligence in Washington - Welcome to the United Nations,2023-07-28 07:00:00,Welcome to the United Nations,Head of UN digital agency discusses artificial intelligence in WashingtonnbspnbspWelcome to the United Nations,https://news.google.com/rss/articles/CBMiuwFBVV95cUxQZkZiOTV5NHlmTE1lcFVfTWljN1BHUUpyRDE3R1A2NHVlWHRmZHZKaDVrR1FSX1FWZlU3Vi1vc2dwNGJjSVUtemd4RThPNEFhUG4zeUs4S0lSaG9rVHhPYWJJTUUxUEtCdnFtdXZQNFoweExMYWxyZ2NFNVdQcHl2c1FJOV9jSGxRcGJYaDM2TmhwS25Xb0hhTUNDWHItV0V5SjkwOURMRWpCQXhLZ3Q5bEZYaW40dVVkeEl3?oc=5
"Opinion | If artificial intelligence uses your work, it should pay you - The Washington Post",2023-07-26 07:00:00,The Washington Post,"Opinion If artificial intelligence uses your work, it should pay younbspnbspThe Washington Post",https://news.google.com/rss/articles/CBMiqgFBVV95cUxNSEFXaE9fZzZyY3I5cXhJcUNMZ3RJRGhXSE45ZWdQdmp0V0VCV3A4TkJyVGlLRUhQSWNKWFk1bHJ1eVVOVVBUSXhwcE9zQjZCRllKbmZrMm5FT0x5eklOUC1hLVN4RE9BRTR3bFZzQm1TWjZMYi1vYldLa0tmVi1sdC1LbE43Vk9wbDQyNy1xNTl4c3JpMDZBUmkwbW1QSXZmQ3lPWm1ZeXZPUQ?oc=5
Is Artificial Intelligence Anti-Black? - Forbes,2023-07-24 07:00:00,Forbes,Is Artificial Intelligence AntiBlacknbspnbspForbes,https://news.google.com/rss/articles/CBMilgFBVV95cUxNRlh6RVNiTDJ6TXlkR1RMTUlfRW01bFJXRmVVSmxTOGhYR2hjOVlsd1VORXNSNk1IR2dpcFVEcG9TSUlHYlE0VS1kLWlMVmt1ck9JeV9PbkVwVlJTUjk3c1dhTU1mQjloLWhpTEowdFNmdUxyb0tkUGtzaDdqamUzQ1h1bGc5bVhNUjJWbVUwRHVCU2xlN1E?oc=5
The Difference Between Generative AI And Traditional AI: An Easy Explanation For Anyone - Forbes,2023-07-24 07:00:00,Forbes,The Difference Between Generative AI And Traditional AI An Easy Explanation For AnyonenbspnbspForbes,https://news.google.com/rss/articles/CBMi1gFBVV95cUxQWFN3UURhNGxjZ2ZMYWFxRTVLMlFTXzFfRTJ3aXRXekYwelF1ZFd4RjM5eFV2Y2lmQW5JMWxDWTBWRzRuLXV2aG9FODVwQnQ5Y0hfWW5KbUN1QjcyajVKRElqVFN0QXhWOUdCYXhVX3VHZ0xSLXFDMGp4RmE5bmpKQTI2N0V0ckdDSDMwTjE3TnhPd2ZDTExyTkFoWktiMW5YMkFKSUNpRHNmR0NVZU41aEczdV9VaGxqa05MVlJxT1RmMzFFTk0tOGc2T18wRVFESWdCdUtB?oc=5
Senate Judiciary Subcommittee on Intellectual Property Hearing on Artificial Intelligence and Intellectual Property – Part II: Copyright - Crowell & Moring LLP,2023-07-26 07:00:00,Crowell & Moring LLP,Senate Judiciary Subcommittee on Intellectual Property Hearing on Artificial Intelligence and Intellectual Property Part II CopyrightnbspnbspCrowell Moring LLP,https://news.google.com/rss/articles/CBMikAJBVV95cUxPa21uYjY1VVJsaXR1MUVjYVNHWTBtNWlLdVV6QzJlM1BSWG9iSV93MGU5SUZNdHVsejNUZ0ZzdzBvNlozTnEzbk55dXluVl9uZjhITGFmMzd0R2tlcm53VGVER2xvR05ad25zRUFFclhZeUhENnlLQTNqamo3cDhPSlB6dXQyTGk4YWhSU1VKaGRRMU5PSGNuM3VOVUhrS2YwdjVWbHd3YnJBMzRneWk5WEF1S2pUbERVVU9sRHJRMXZfd1ZFeVM5aVB4QmtKTXNGQWRQRkJsTE1HRXhjVDV5c2lXX0dhZHY3T29aWnVzSWIxWkpHY0gtMDdRN2NJQmJMaTBjY3JPQkN4RVRLZUQ2eA?oc=5
Meet your new IR co-pilot: Artificial intelligence - IR Magazine,2023-07-26 07:00:00,IR Magazine,Meet your new IR copilot Artificial intelligencenbspnbspIR Magazine,https://news.google.com/rss/articles/CBMijAFBVV95cUxQU2J4c3VpNmVtcjc1a0F4bV9xOG1IdExLeXYxcXd2WXJkU2xjekUzcllfVjN4SHZ6RWpnVHNWWUQyTjFqY25IRE1hT2FndzVJWXEyc2FKTDZxSURMQkZ1a0R3WWYteVJyejFUV1g3aGx0S1ZScm5HRU51MlZwRVRlOEJDa1ppVDByV251SA?oc=5
The Rise of Artificial Intelligence: Investment Risks and Opportunities in the AI Era - Brown Brothers Harriman,2023-07-25 07:00:00,Brown Brothers Harriman,The Rise of Artificial Intelligence Investment Risks and Opportunities in the AI EranbspnbspBrown Brothers Harriman,https://news.google.com/rss/articles/CBMi5AFBVV95cUxNUkw4LUJ4ZVVqT1AyeURqTmx6Wlo4VWI0X2xnX1loVVdsRTJVSVJhaVBZbzE1LUJScG9Tc2NLOXF3Rmtmdmw0b1BSYS0tVWRDXy1ITUlkX21sa05iX2I2RFJab3lqR2lzbFFyS3oybmptV1lxVUZacHc2MDRLSExqRXFWcUtmWi1XR0hFQ2tkVExhSjdyQXdMY1dvaUl4d1dicHJNSVFDYkF3cWQwaVpFOFZTTkQ1VklFbzhlT19KY0lUdHFWNU5ZZDlwTkIxZ1VFbExDZ1dCeGlCTHRqOHZfaVFWUnU?oc=5
A 'neuroshield' could protect citizens from artificial intelligence - Rice News,2023-07-24 07:00:00,Rice News,A neuroshield could protect citizens from artificial intelligencenbspnbspRice News,https://news.google.com/rss/articles/CBMilAFBVV95cUxQbGFJV3c0M0tKTHpQcjE3c0xiSEhTQzR3aEhWdVVfSi1JZjR0a0lxUGpQN0ZRbGhrM2RtVWlWckpvc3VfYzM0U3M5VnV0WmRESzNpSHJ2Sjd6OE9WNlB1VUdrQzRnRVVPV0wzUm41dkx1akZTTmJvUDdXRC1wNTVNd3RCdFIxajAyM2xRaUdfQmVxMlBp?oc=5
"New artificial intelligence-assisted technology is planned to track permafrost in Alaska, beyond - Alaska Beacon",2023-07-25 07:00:00,Alaska Beacon,"New artificial intelligenceassisted technology is planned to track permafrost in Alaska, beyondnbspnbspAlaska Beacon",https://news.google.com/rss/articles/CBMiyAFBVV95cUxNNnZHLXM5dloxSjBwRzBhQUVicFlQbHlIR3ZpWUdVeVFEWThydjJtTEtRR2doMUxEWEdFMlZqMlJZSWdBRlZUbXNDNjVqZGpNd0ZQbHVQUWVCbmRpUWVLV0htS2lma2tIUTZBNWZ3S2JRM0dLZ1diVGtPUmZpUmFxQ2hJSldjMUl6bmJ3dURHVWZlOUFUMEpVbTZLUk0wSDdqWUZzZVJkZGNTMWJYXy16TE9ta2ZMbEhaeVpCa3k1VG0wckRPUTZWSg?oc=5
How are Dance Artists Using AI—and What Could the Technology Mean for the Industry? - Dance Magazine,2023-07-24 07:00:00,Dance Magazine,How are Dance Artists Using AIand What Could the Technology Mean for the IndustrynbspnbspDance Magazine,https://news.google.com/rss/articles/CBMiXkFVX3lxTE9RUHc5ZlZIQl9DMmlocVM3SVprYUxxN3k2Q2w5elpOT0VVQ2tRbVRXMUswWWVpUFNhaHZ2cUduSExrak9xNG9LdTkwU0NkMVZDdGdveWlOZnE0bmgwOXc?oc=5
A nystagmus extraction system using artificial intelligence for video-nystagmography - Nature.com,2023-07-24 07:00:00,Nature.com,A nystagmus extraction system using artificial intelligence for videonystagmographynbspnbspNature.com,https://news.google.com/rss/articles/CBMiX0FVX3lxTE01bDl5Wk9sT0tVU1dmY21TcEdYck54bnpsRVBrMW9aRl9fVS1WSjdXaHgtUjd2a0R2RDNEY1VQaEk5aVhibldvSFhXV3c1dTlpU2VpMnREektYRU5pZ1hR?oc=5
Fears about AI are phobic and downplay potential advantages. - Psychology Today,2023-07-26 07:00:00,Psychology Today,Fears about AI are phobic and downplay potential advantages.nbspnbspPsychology Today,https://news.google.com/rss/articles/CBMisAFBVV95cUxQczhNb1FqbGVvc2FYVHpmd2k1RTVVa1BBbF91LXJZRUMzNjZXYmdubW11cUVnNXFnLWtnMmxlTkZXMWNvOElNNzl1aGtudzRrTUxpdktUR0NmSDlwMW9OTjl1U1Z6c3hDSno3VC12WllleFRFQzNXSHY2NUFpUW9SWEhrX3RmNW1KRnJDME5UVkFFQWVuZlV2cGRLVEpwbjBHZHg5TVlNLXUtbndDenl5adIBtgFBVV95cUxNX0RIemM1OFNYX2xKX3FKWENjRG0zU2lwZ2lXZER6d2RXLXZ0X09ya0E2cGpBQnJqUzVJNGh5ZS04ZVlJV2JOY2pCNUVBeFBwdlZtSUhWVWNnVHdWWkc4bEF3RmZLYzZwSDJLTUJJU0VuRnV1Z0JLVlFWUUJfWTUyUTR1SVUteHFqUGhMd2xyaGlnemR5b2hSTHFKcDFjXzF3emVFakMtek9QTk12bDBxYTNoQ1VQQQ?oc=5
Artificial Intelligence (AI) and kids: What parents should know - CHOC Health,2023-07-25 07:00:00,CHOC Health,Artificial Intelligence AI and kids What parents should knownbspnbspCHOC Health,https://news.google.com/rss/articles/CBMijgFBVV95cUxQVHUxWVlCWW5hd2lnVWd0d0R1RjRITnJMeXFpeGM2QWZ1RldBZzVmQjY2SDZERlJtRWxWUmV5bnJsZHVwTUxsZ1VrRU90YkM4cndMNmtpRDRrTGZBRzdiWjNHZEJzZjFmdGdzWWIwUzVVWGtSeTBxSGJIaEotaEl1WFVKSXZyMzVMNU5ZdTBR?oc=5
Artificial intelligence is powering politics – but it could also reboot democracy - The Guardian,2023-07-28 07:00:00,The Guardian,Artificial intelligence is powering politics but it could also reboot democracynbspnbspThe Guardian,https://news.google.com/rss/articles/CBMisgFBVV95cUxPSFZWeU11QlVRcUVfcFVTQVZWbmZjN3I0MmhHSGNtbjY1ZVotaEZkVDZ5bHFpX2M2bnBKb1BnSks5c3Z3amhubEZrRFJaSXhMRWtQUDAtZDVzb1ZXWEtsWEtYMnM4Q0FSLWtzdDIwZE16bEhWc05Oa05ZaVI2SU4yUUpjRkduVm1PaGVBOGZaa3VXd3lDZ0NCSHUwcnh1WXlXN1p1YThzS3VTY2RUbDFYek5R0gGyAUFVX3lxTFA3dnJLeUlhb1Q0VV9rMVNORnhmOEs4MVpjcXB2LXRVWmdDNkF2bTVtS2taS08wb1JHMzRERHBsNDZHd1o1dWg3S2F6a1FIRWgxTl9zWTc4SGJxZ21wT2dnVWRtVzY5MmM2ck1fdHhUWENMUk9WcHphSUp3RzhBc1VLRHVzSXhHOUlielA1ZnNpOVZoQ2ZlVzBpU21raUdVcExYVTdGWUk4NWc0cVpHdUxXc1E?oc=5
A new dataset of Arctic images will spur artificial intelligence research - MIT News,2023-07-24 07:00:00,MIT News,A new dataset of Arctic images will spur artificial intelligence researchnbspnbspMIT News,https://news.google.com/rss/articles/CBMioAFBVV95cUxQMXczWk9PSGp6THVodndLdTJCdDFFNVFPSGprc2luYlpoOW4yM1F5ZDhnYmtqdHBuWHNMWTNoS1FXTkFIMTZkSXM2MGdpX09hcnJzOEJNM1NVWWozeXQyU0FRazlCTG1zbm5YSk9RTDFsbU5mdVYwTkM0cExmekJ1NUlVRm5WQmRyNk84VDlxSXJzaWJNdVpjaVdicmZrN24y?oc=5
Senate Hearing on Regulating Artificial Intelligence Technology - C-SPAN,2023-07-25 07:00:00,C-SPAN,Senate Hearing on Regulating Artificial Intelligence TechnologynbspnbspCSPAN,https://news.google.com/rss/articles/CBMioAFBVV95cUxNVVNlaG94SHFQeTJPb0lyNkVjd0w3R3drLVdjOEFPZmItNzFDYUFOd0swZzBta3VqTU1qYTZBV0hLbWJYQ3RKZjdXQU1Ydm1ybmpYUk9IbDVWYndoSWxuZi1NNUUxQXV2ZURDSWt6SjJNNi1pUWVNUnNpc1kwSHZlVmVuOXZYclZ3YkZhazBZQ1BGbmdnZWgtbFQwT3hHcFdU?oc=5
"Hawley, Blumenthal Hold Hearing On Principles For Regulating Artificial Intelligence - Josh Hawley",2023-07-26 07:00:00,Josh Hawley,"Hawley, Blumenthal Hold Hearing On Principles For Regulating Artificial IntelligencenbspnbspJosh Hawley",https://news.google.com/rss/articles/CBMiqwFBVV95cUxNWVEzdlhqM01sYndvUUJEWFBVSGNTenpwYUUtZE1FZzc4MDljWlJ4YzROOEZIRUpkZXJ1OTZnQkM5Q1VVMzNlMTZSam9PdlA2V3ZUdnlIYmdaLXJ4b2djVmJKRTByVmlSMXFLMVdHNUtTWVZaYUtXSU1JZExrbGpCZmpDSElRcnBYZmQzM3VIOTVTRG1VM193NHNkTlZCUERYQ25nSzJhT29qSlk?oc=5
China's Interim Measures to Regulate Generative AI Services: Key Points - China Briefing,2023-07-27 07:00:00,China Briefing,Chinas Interim Measures to Regulate Generative AI Services Key PointsnbspnbspChina Briefing,https://news.google.com/rss/articles/CBMirAFBVV95cUxNeW94UGVya2tNSlZqd2tzNlJ6YjVXa0prdmhqS2hoOGRIclRLX2ZkY2ZsZFpudkVpeGtOZUh0anRnUVRLM2FiTlFhRjFGbEdQU2l5UmY1VW5laWVuaGU3QXZCVlVlVDJxX1NGYjNiVk1LbGo4MlFndkhOMVpuUDhmbkZ2YlpuNm4xaXJsbzFyQ3pPMzBLS093SG56M3B0d2w0dUhFZmk2MzlzUGNY?oc=5
"AWS offers new artificial intelligence, machine learning, and generative AI guides to plan your AI strategy - AWS Blog",2023-07-26 07:00:00,AWS Blog,"AWS offers new artificial intelligence, machine learning, and generative AI guides to plan your AI strategynbspnbspAWS Blog",https://news.google.com/rss/articles/CBMi5wFBVV95cUxQc2JfcUNNTkE0eVc5RzFaLWFKMURJRGNjd29YdktGcmxwWFRwdFBYVkdaM3ZZYzZ2WDF1TVg1MnlUQTNPM1FmVHA0SDAyaWRqeG5qaEloUi14TklMQVAzVWFsTUVYdmNVTk1ScmpnVV9QYW0xTUVldS1zMEgwcVR1X2VoT25qYzN3VjVBTjB0WDB3T0tJdmQ2dlNESDFjN2hid0NlNXlsN0ZpTzduX3h2c2xhRWFVdHZqam9IUzFIel9XVXVlUWhfU245V0VWREUySzMzZFVPc2d0M2NRNV9ldWV3SzRzZDg?oc=5
Artificial Intelligence (AI) and Machine Learning (ML) for Healthcare – Are You Ready? - Alvarez & Marsal,2023-07-27 07:00:00,Alvarez & Marsal,Artificial Intelligence AI and Machine Learning ML for Healthcare Are You ReadynbspnbspAlvarez Marsal,https://news.google.com/rss/articles/CBMiuAFBVV95cUxQMWZlbS11dmJHLVVQcG9ONWxocDMxRUgyUGx0MTUyZGpxOEszLVAtY3AzeVJSdkhpU2k0RXNmeERsY0NUZEtScE01U3UyNWtNcmJqMUtkZ2cyV0lVN2lpUjZQWXVKRS1CRUJlMXU4Rklsb3llSF9YbTVzLTZ1dE51M3g1N0d3cnk0VERMWDB2WHFDaHByUndRcGhQWmJZRWdtcTh4YmlPM29xMDhmNm9nQUdWcDcyc05P?oc=5
Contracting Pointers for Services Incorporating the Use of AI - Morgan Lewis,2023-07-27 07:00:00,Morgan Lewis,Contracting Pointers for Services Incorporating the Use of AInbspnbspMorgan Lewis,https://news.google.com/rss/articles/CBMi2AFBVV95cUxNcGZ0dHhZZE1DdDBhVWtWUFJuNmhDcTFTUkxuMS16NU9XNWFpRlAtUUhmQTVTM2dmb3VydXd1b2oxTDlYWUM3UlFGbHQzT2xPYWQ1VFdOdlpoZzZDOXhRcm8zNUJMU21KaURXTi1XcFJVV3lyWTl3V0RySzdyV1RTRW9UTEhQeC1NX08tTmxDVTU1UzRXeDREYTVfRXlYeUxoWVI3R1NsN2NHSm5hMWNOZS1fbEVaWkFOUU5aYU9aU2V3RkdER19FX2lnS0tXWmp3MjA1cnhpMXc?oc=5
Dakota State president moderates artificial intelligence briefing for senators - South Dakota Searchlight,2023-07-27 07:00:00,South Dakota Searchlight,Dakota State president moderates artificial intelligence briefing for senatorsnbspnbspSouth Dakota Searchlight,https://news.google.com/rss/articles/CBMivgFBVV95cUxOd1FVWFc1UzFwWXhscUtOc2N3MEFKVnZlMW1NN1ZmNjlrUXQ0UjlMU2hMSndjTnNLeUI0MGF5eGR4d19wS01GZ0U4bk1ZVVNnM1k5T2JKV3FVMGZZejh6cGRqOWdQM0lUQTVBeGRjR0VKT2xTeU80OFlyZ21vS0dhaXYzOUk0QmUtZHFrZUFfSnc5TXMyR1pWWF8yR2lXaU0yRkVtRmRzT25UWm9nZFd3LWw5ZWhTUXozd253cTN3?oc=5
Artificial Intelligence at Bosch - Emerj,2023-07-26 07:00:00,Emerj,Artificial Intelligence at BoschnbspnbspEmerj,https://news.google.com/rss/articles/CBMie0FVX3lxTE52RVdlYUxKOEN6MXZEUVJxWThSX05VbDRBRGtrMlNPdUp0bUR2RjlYcmhpRE1NVlpTTXlDMWQ3RUR3d2Y0NDNMNU4zenI3Q1E3dnNXQmR0ODNVSnlJbEwzdExMZkstRXZ5N1VQbHM4MXAwWGNkQm9CTHNPYw?oc=5
| How Artificial Intelligence Is Improving Supply Chain Operations - inboundlogistics.com,2023-07-25 07:00:00,inboundlogistics.com,How Artificial Intelligence Is Improving Supply Chain Operationsnbspnbspinboundlogistics.com,https://news.google.com/rss/articles/CBMiqwFBVV95cUxPaGtmTloxVms2OXB5MU9SdnJLMjdLMXJYZzViSXhBRXhlVmI1dEp0aDVZS3ZPQzhLUEIxLVE5Wmw5UWEwUVk5VEFZcFJVSnVxYUpiVV9qaVYwbEMyRGhDVHNabkIzSnUzOXF0S2FYV0hWMVUzc3FkTUExTjRkZHRLNXRKS0ZaOF9TNHVYZ2lJMmxLRzBYOUt6bERGTVctbUhkbGxmamVmS3A0Wkk?oc=5
Suicide risk detection using artificial intelligence: the promise of creating a benchmark dataset for research on the detection of suicide risk - Frontiers,2023-07-24 07:00:00,Frontiers,Suicide risk detection using artificial intelligence the promise of creating a benchmark dataset for research on the detection of suicide risknbspnbspFrontiers,https://news.google.com/rss/articles/CBMikgFBVV95cUxNMVh2c3pJMHJTZFdPU1czMEw4ZGZVWjdveFpwelA5NXN3b3FaTVdyYTZWOUtwc2c2SXBDQmtiODY2QTR5UUVQNl91S0x1aWd3R002Y1FlaU9tZ0c1SlhWSmxaMGdKNGNBd29KWkhRVlNULTRhTWlGQS1ZaHRRanh3LWJod0RtVXFmWDkyOERGWE9XZw?oc=5
The future of AI in medicine and what it means for physicians and practices with Tom Lawry - American Medical Association,2023-07-25 07:00:00,American Medical Association,The future of AI in medicine and what it means for physicians and practices with Tom LawrynbspnbspAmerican Medical Association,https://news.google.com/rss/articles/CBMiwgFBVV95cUxPVmp6MHFuSUtUem5lM1FmWUZxbjhqM0xpQWpJT0ZyZjI4V0FzQXhuZzZwd3d0bFhiMDR4dzFQWHpjdk1tUERnb0hEYTdFbHpvMXh1R1NhNzFQel9vT0lwTFM2ZWJoUjBXOFJaN1RzeHUySzhiNXJfYWQ2UElETXB3alJaUHlUSDhjR1kwTi1BZDNoMG90LVVlR0RwRTh3ZVhBQXM3M3hGVWxRM1NaUTQwcXh3NGpRWnhiTlhGNU8xUzlrUQ?oc=5
Writers strike: Why A.I. is such a hot-button issue in Hollywood’s labor battle with SAG-AFTRA - Fortune,2023-07-24 07:00:00,Fortune,Writers strike Why A.I. is such a hotbutton issue in Hollywoods labor battle with SAGAFTRAnbspnbspFortune,https://news.google.com/rss/articles/CBMilAFBVV95cUxNbk5TaHpKdHNlVjRUcUhEZkVtZ0xLR1I5U1VvRi1KMWoxMDV0MElPYmxlX0EtaEtLMWF2QlY0NmQ1V21Zc0l2enZndjZ0VEdXOUgxVVExSjZKejF2cE1kdEFBeURfcEw1NlhyTjN2dzVWZ0I4eVd0UjZLWmJVcDRYdE05bjBFWFk3NE1udkR6Wmt2SDhM?oc=5
Opinion | Our Oppenheimer Moment: The Creation of A.I. Weapons (Published 2023) - The New York Times,2023-07-25 07:00:00,The New York Times,Opinion Our Oppenheimer Moment The Creation of A.I. Weapons Published 2023nbspnbspThe New York Times,https://news.google.com/rss/articles/CBMijgFBVV95cUxNLU9KYzN0Q0FUM1lDRDRBRHlwdnk3VnVJXzdLaHkzWlNQS1NvTW5ySmNpSEt6TFJVSS1VaW5zWFh5d3ZnNlgtb2U1eHE4Zzc5eTFlNlAzenJoYzdpSEtPYkdiSUtWb2dOVjJ5Q00ydXpmNzY2QzlRNndfam9pejNyYmJTREg1bDNIbDFkUjF3?oc=5
‘Bargaining for our very existence’: why the battle over AI is being fought in Hollywood - The Guardian,2023-07-22 07:00:00,The Guardian,Bargaining for our very existence why the battle over AI is being fought in HollywoodnbspnbspThe Guardian,https://news.google.com/rss/articles/CBMimwFBVV95cUxQNldCZ1YydHJRNW1Kc3JHcW5zXzROY2NobTNlbk1SYzdHekhWSUl4WkxsVVZYRU9yQ1QxR2g5aDBRRTROTnJTU2FQREJGNHVOX0RoVG5ORXUyZ3laczRUWm96a2NGQ3o2R1Zuc0lUTGloM2g3UHlVbmFrUlhNSXFlWnU0WmdhNmUwUU9PWjJKZ0pldExqUkNveTk3b9IBmwFBVV95cUxNVzRaWnhCRFBBdGxJMTZjTEdxdHlHdUQ2cFc2Vk84STdzVmx3RGJkQ2Rac1lTTE8xcHNLVlBzZzNucExRUHhYTHRJNDZXa2V2S3M2T2d1MTloSHh5YV9ob2ZxZ1FXSEhYYkQwaWhPTVRjOTJTak4yZjJhaDVGRThKQUhnd2VacS1Zb1ZfVzRWa3lKWHg5b1kzQXp0cw?oc=5
The Progression of Artificial Intelligence - Quality Magazine,2023-07-24 07:00:00,Quality Magazine,The Progression of Artificial IntelligencenbspnbspQuality Magazine,https://news.google.com/rss/articles/CBMijAFBVV95cUxQYXFCTV9mdVFmLXhFSkhXN2V1ZmhlRmNtMzFUTUdtRk1WZlBISGJLejIwelpuVmlCOWwwQTdPZkNta3YzTGd6aFpNYkc1MERxOEZySlBXelJ6N20yRFp6UUxmMURPbVU0S09oQzNHQjV0dzFrWVVWQXpIZzZFWHp2WWJIZXFQWWhaM1ZyYg?oc=5
'World’s first’ energy drink developed by artificial intelligence - FoodNavigator.com,2023-07-28 07:00:00,FoodNavigator.com,Worlds first energy drink developed by artificial intelligencenbspnbspFoodNavigator.com,https://news.google.com/rss/articles/CBMisgFBVV95cUxPUkpyRG1tMi1MbnlTbnBiVU15RnNWY0ttNTFIQld2azdraTVUTWk5U1ZYWjVaSV9wVE5PTkhNdDRQV0x5bFVxTEZBamhQSmNqdHBmNDlqZVJncHQzMlBGLVM2TUZDNmUxT2NiR25fWlJEODRWZkk1cU52N2pWV0N1M3ZzS256bXRVSUU5Z3NPM2FYUUF0X01JLUljXy1PWkFyQXl6LVdmb0NlWmtpNVl5SkZ3?oc=5
Risk Adjustment in the Age of Artificial Intelligence - iqvia.com,2023-07-26 07:00:00,iqvia.com,Risk Adjustment in the Age of Artificial Intelligencenbspnbspiqvia.com,https://news.google.com/rss/articles/CBMikwFBVV95cUxOdG1DbkxTRnZaTElfdDBuYlNDVVdMQlZkeUtHajUtU3k2TXBSZXE2VzlGWk80dzVGa1FYTEMwcThDZXU0VHFoT2dxZklNQU1rTENoVjFsVFFRSDBQQ2tNNlNWaktDSlg2R1JUQzlzVk5PTjRJdlUyVEI2TUVQWjkxQU1zXy1DUkJMOTI2ZEV6Yjd1OVE?oc=5
1. Exposure of workers to AI - Pew Research Center,2023-07-26 07:00:00,Pew Research Center,1. Exposure of workers to AInbspnbspPew Research Center,https://news.google.com/rss/articles/CBMihgFBVV95cUxQd3VNdjFjOWRHM2dRUHRxRmRPWkxnR1lzSHBvTTV0WWxvX2NQOC1ua1lMajlSRGZDdE9fY2t6Q0xJOHhoYXViSHhHZDZuTjBKUVRESVdaZ05tT1RmYl9pRU9qcklQRlJMeHBXTGtBckRVdWhPZGlpSzhkQy11YmFUalhlMTg3QQ?oc=5
"AI in Defense: Navigating Concerns, Seizing Opportunities - National Defense Magazine",2023-07-25 07:00:00,National Defense Magazine,"AI in Defense Navigating Concerns, Seizing OpportunitiesnbspnbspNational Defense Magazine",https://news.google.com/rss/articles/CBMixwFBVV95cUxOdW5nNTY5SklzZjNiWXJDUXp0ZWpjYW9SZU95Wk1CYV9qUXJoc1gwUDFMNUo3S1RmanVwTmMyaE85WDFTMG5WS3RfTXl5WEFmZFNiUS05UzM2VzMwM3J3SVNRVXp3WVZZZE5yUDRTT0k1UlF2THoweDQ5Y1p5dUFmYk1nTjF4TllkV1BsYXlYY3VtSTZQT2dDcEVRVjZmZHZmVjUxTnd0TDJ5RkFKZDVMdUZxX0o1YjRrc2hTOS1temhtbFhScENZ?oc=5
Machinery dealers use artificial intelligence to improve farmer service - Successful Farming,2023-07-25 07:00:00,Successful Farming,Machinery dealers use artificial intelligence to improve farmer servicenbspnbspSuccessful Farming,https://news.google.com/rss/articles/CBMiqwFBVV95cUxQVDhzMDktZjhOa3lPOVhrRmVsUG01Ykl3UVBCWEFqTnYwbXJEQ0c1cHRuNHBMSDMzbDEwTTg2c1ZzYzYyZXNEQk1PNm95bXZ5QW1CWjBaTkl5b2laLUNnUGRnR0JRQzZ0bW13WWk5dXNQWHFKUXo4dEo3OGFRdmo1Y3NqMFRpempBTzlMTnpPZG9aeVZ1dHhwVVZ6RVJ2bFlnTnAxUTljd1hWdjg?oc=5
Artificial intelligence and the benefits to energy - Enel Green Power,2023-07-25 07:00:00,Enel Green Power,Artificial intelligence and the benefits to energynbspnbspEnel Green Power,https://news.google.com/rss/articles/CBMiiwFBVV95cUxPRUJJbE5IWkZHQS1mZDI4MENac0pPUFkyUTVXbzZQNV9kNXVYOF9TUnpLM2JzeV9QajJ3bzZrSmkwSmd3eEVXUlg0WTVGOUYyQXdQc3pIaEtPWVdPTmN1d0NKcFRBempjZkxXOHJIUExZZEhPaXdGODFLdmU1ZjlELXp3dUdtU3dkQTRj?oc=5
"10 ways artificial intelligence is changing the workplace, from writing performance reviews to making the 4-day workweek possible - Business Insider",2023-07-27 07:00:00,Business Insider,"10 ways artificial intelligence is changing the workplace, from writing performance reviews to making the 4day workweek possiblenbspnbspBusiness Insider",https://news.google.com/rss/articles/CBMigwFBVV95cUxQU2ZzcnkxajhRaHN5VGo2N2NjT1VGVzB5UFdjU2hFdHNPTV8yT0xSZW1PQmNJVVhuUE00MThKcF8tdUw3blJyT00xLUxIUVBKZDkzQ0hmZUxOaWJEVTlybzVCUnBRTHF1STlmNjZJQnFvZDEwVXphUG9RZjBpaE5HWi1iTQ?oc=5
The Four Risks of the EUs AI Act - FTI Consulting,2023-07-25 07:00:00,FTI Consulting,The Four Risks of the EUs AI ActnbspnbspFTI Consulting,https://news.google.com/rss/articles/CBMipwFBVV95cUxQY05Wc1BEZFRSMktBeG5TcHlTd3dLcXc2cmY3VjRRMkpnVHk1XzRPRWNiR3NUdXNGTHZDVWRreEpQQjJMMmRHaWNxeV8zNnJ6SGJ1VzdZa1pyVmh1anZlMVAzUHJBRGhGdGhkaXZ6SGItUmQ1UEJ2emI4Q19Hc0d4MFYxc3NuWXhiNUtzMGZKc3lOWVQ4eVViR1dKaHFiaWZrQVZjRGRTSQ?oc=5
"Accelerating AI, machine learning in research - University of Cincinnati",2023-07-24 07:00:00,University of Cincinnati,"Accelerating AI, machine learning in researchnbspnbspUniversity of Cincinnati",https://news.google.com/rss/articles/CBMizwFBVV95cUxNa2NmMUlOSXZMcktXZG9sVjk0R1BBckRPeTlBaTYtbU00N2NDLXk4SW5XaDl2VnpNVGhfdzZ2ckxpb2wyXzkzdTZuNVNmVE04VmxyZ0wyVUNlUDAwb3hfVWtKdmZxTjBJaW94TVRXR0gzUXFTVlZ1b1RNcWVXaWxJMG9TYVhLVk5TR1BWY2VocEFnMlUxcWNpLXFybThwLVEtUzZuZWd6SlE0Sm8zSzVSLWlXZXdIMk41M2VNU29nMU1OVWRweWJDenp1bmhVYlU?oc=5
Artificial Intelligence in Retail - Loss Prevention Magazine,2023-07-26 07:00:00,Loss Prevention Magazine,Artificial Intelligence in RetailnbspnbspLoss Prevention Magazine,https://news.google.com/rss/articles/CBMicEFVX3lxTE54aHZvVGxmZHgwd1ZNNzM1T3A0ZmRQWTVEY3RXV3dvbUcyUG5ZeWEtb3hwbXFaZVc2SmhnTk5ZWXpUU1o1RTQtYkhKYjhUc3VjMDl0WE5FY214U3Bkc1BfakdobWFLMGNST2wxSW1sX2nSAXhBVV95cUxPc0R2UG5OMU5VMXdYOHphcllHWWZMajh3LXh3LTFfYjJPVk1yLVFDU0xWb2FzaFhlTHdJZVgxdl8wQVB3RERzbEJPOUJ6ZjByNlJHdnFfU081dVg2ZnpkN0djZVZZYVZTN181OEtJSm44czFaRmFyZGM?oc=5
The rise of artificial intelligence requires a human-centred approach in conflict zones - ICRC,2023-07-24 07:00:00,ICRC,The rise of artificial intelligence requires a humancentred approach in conflict zonesnbspnbspICRC,https://news.google.com/rss/articles/CBMirAFBVV95cUxOV3pKRHM1ZHlNMTBoTklvYmNSa2drUFREdHhRaVdMV0F1YlRtdm5uVlpGcmRIVWVPV0hud1JrUlRLaFUwUDZyUHE1SlNNc1A5S3ZULUdCSTRJVEMwUEVrUTg0eWhGcnd5RFktN3pVNjdTUmdycUh2Z1lXZGlmek9fT1h5WGYyWmpDdzIzYXN3VG4xQmtKOWFWM3RqWXZTdnZwd1pVR296QVdONEla?oc=5
UF to build $20M artificial intelligence hub in Hillsborough - Tampa Bay Times,2023-07-28 07:00:00,Tampa Bay Times,UF to build 20M artificial intelligence hub in HillsboroughnbspnbspTampa Bay Times,https://news.google.com/rss/articles/CBMiqAFBVV95cUxPd0JXczhWVEVqYm9WeklnR0hrQVk4dGFFYlk4Y2ZKalZDR19SUGFhaEt2azNPUjVIcXhYTkpXTEdVSUVvOC14TE5vb3NwcWJwaEoyTWpkQ1ZmTmJ0cmpXRGJyZEQ1cWhqWFMyR29ZNGsyWU1hQ1U4ZW9PU0lnVXY4V2VhUEFyUnA5MkR2bDlUZXRxWlBqdk81eTZodk9wMTd0ZC1EN0xqX1c?oc=5
Fake News Meets Artificial Intelligence - Yasmin Green - The Dispatch,2023-07-25 07:00:00,The Dispatch,Fake News Meets Artificial Intelligence Yasmin GreennbspnbspThe Dispatch,https://news.google.com/rss/articles/CBMifEFVX3lxTFA5MUJRSXVpWGdORC13a0xLYWRPSnNkR2w0VFpvVmprSVZQczJfWmY3VjZBZHc1T0phWlp3WDhJbzdXUWNyQ3dtMTN3SzhkMEZjSVJOWnRwTlNQUlViSFBtR3lidkdFWEFJNlVydW5Ka1R3NFFrbE03VlEtcVk?oc=5
"2. Earnings of workers with more, or less, exposure to AI - Pew Research Center",2023-07-26 07:00:00,Pew Research Center,"2. Earnings of workers with more, or less, exposure to AInbspnbspPew Research Center",https://news.google.com/rss/articles/CBMiqgFBVV95cUxPY1F1VUlxQ21ha0JjUUU3Smg4OGNaMDlKc011OE85R2g1cV9MRm5YcDZnLVZDY3ZpUmNHUGdkWFhjT3hTdC1uaXctS3I2MGd5SnRiek1vQll4MVVCZ0N3NGdySTdDc1U0dWFlcUVUZG4xWUs1akU0c09xeTV1MlVCOFFTRUVwdi1LUGkyQVZjT1N4Q0dQb0Z4cVpoT09ZODJickdJU0RhYk9yZw?oc=5
Love and relationships in the era of Artificial Intelligence - CNN,2023-07-27 07:00:00,CNN,Love and relationships in the era of Artificial IntelligencenbspnbspCNN,https://news.google.com/rss/articles/CBMiowFBVV95cUxPX3haVEZUcWpUS1pseEVqVjkwYjlVcnVjYWw5NkVnTHAwdER3YWpJM3VCQi1xY2lQbFNlTUg4b1djVTFLX3NWdWd0NmpmUkg4U2l1bTVSdnZZQXZTeFhEVl81cXlHMThweGRvUnVfNkp2czFkRy1NYjNNXzVoRXljQjg0RThSaFFzNlNDTzhSVlRzc1ZqeTN5NVlBTDItRXRkY19v?oc=5
Why You Should Create a Plan to Implement Artificial Intelligence Now - Inc.,2023-07-26 07:00:00,Inc.,Why You Should Create a Plan to Implement Artificial Intelligence NownbspnbspInc.,https://news.google.com/rss/articles/CBMiqAFBVV95cUxPNmNORGFHeFlIMVdUZV9kYmpwWFZrbEVOLTdGSFRlQXZQeGl4aEhXOEdiQW5pTnhtMFFFbE1mSFFtVGZ6YlJ4VUFFR0VkbkFPX3ltWjFnYVlITnZjVUF5Rk9WcWFJcDhMZnZiLW80cUVWM1ZxSjRMX1hXZWpyLWxTcXNFbkFEQUh3SFFoSk1NTm1qeXZ3YlktN1ZsVjZtS21fdGJmQzMtRlY?oc=5
Unleashing a new era of productivity in investment banking through the power of generative AI - Deloitte,2023-07-27 07:00:00,Deloitte,Unleashing a new era of productivity in investment banking through the power of generative AInbspnbspDeloitte,https://news.google.com/rss/articles/CBMi6gFBVV95cUxNTzFoWFNhNXRJbnlFeV9ZMFZZbElIb1k2YUN2azQyZWdNUWttVE5WNUYwVHhmMXR4dlhoczB0eW56ZHdUTEVCRmtISm9KWnBYZzB2NHFGTWxOWk5aQktpX2RPYUVDVEt6NTJjcUs2b3B6ZFVzWVlRc05YSGoyUDVHcWVqNW9VTlVHNl85cy1EUTFhWDAxcExLQ3lxUnBsaHU4WUswOFRSWEFjT1ZBbTZWOWVyc2FLOGRRWmltU1hsVzJuQUZIZGZLU0JkMVVVdEJ2VVhRSUhzVnFYS0lzMTRiblowM1dhbGt5Ync?oc=5
Weizenbaum’s nightmares: how the inventor of the first chatbot turned against AI - The Guardian,2023-07-25 07:00:00,The Guardian,Weizenbaums nightmares how the inventor of the first chatbot turned against AInbspnbspThe Guardian,https://news.google.com/rss/articles/CBMizgFBVV95cUxPeFM1RkxsYkhja010bEZ6cWdFUUZZenQzUmxuZW5BT3BoQkdoa1ljU2F5akprdW02LVRfZzZYYWdSRzJ3VnZzNmVuV1pXUjMyVk5IYW90Q21FeTNsT3Fibm9ESVR1blVtRTd3SnJJNGlMblBKU0FGcmFNczQtaC1RTzVCbktGOVNCNTRSeV9hV1lBZTFxYVVUZ0NYNkg4OVdvd3NRUEE2NmhILUd3MXlhWU52VlZJYXR4Ql8xWEpHS0s3THBQc2MzUk1VU2NvQdIBzgFBVV95cUxOZTNGWDJ0SHJlaHlVWGZIWWlITmxSb0hMaHZKREx4VmJpNFpHbDVUeVQtZzljS3E5U3A0cnVXV0hyLUJESmhCdEd2ZEpfS1lqUVdmS2tYZk9qV0JRV1Q3VmlKVGR4bzJNSks2dk5pZ0ZvN2ZNRFl4S1BaTFRtZmpMQTdQR2NzRWt4c3drYkR4VGVwbnNzOE1lWWpwempTczhJNllxREh1Ri15cjNqT0RnTzE2emliNkV5RzgwbHJUaWs0VWdPOF9kQlZ2d0k3dw?oc=5
Does Sam Altman Know What He’s Creating? - The Atlantic,2023-07-24 07:00:00,The Atlantic,Does Sam Altman Know What Hes CreatingnbspnbspThe Atlantic,https://news.google.com/rss/articles/CBMilwFBVV95cUxQcHJwOUJhZ25MSC0xeWNPa1NrQWJzRHhGOFVTeVdLRXZfU2FzMkRkekYxS014REhOV2htek1SZUpVSkpkM3BFVXMtOGNwLW1rTUlCQW9iR1otMnNHczRWRnl3RXUtZFFuRVdHbjFsYjZ3QmlrMUN0c3p1Y2xsQl8yZ0FudXQtRXFzTWhqRS1yaTliZVhsS3lr?oc=5
