title,date,source,content,link
"PWCS to implement safety screening technology this fall to all PWCS high, middle, and nontraditional schools - Prince William County Public Schools",2023-07-28 07:00:00,Prince William County Public Schools,"PWCS to implement safety screening technology this fall to all PWCS high, middle, and nontraditional schoolsnbspnbspPrince William County Public Schools",https://news.google.com/rss/articles/CBMikwFBVV95cUxQWWYtTXV6b2RlSFRzeVlrVE1DOWNJMHhJRE1la1NZT29UQUoxdVl4VHpKR1ZzcnY3cThWd0U1RElOVzVEcTJ3QWtWVVJEWFBwWGx6S2UxaVRNV0gzaVM3UDg1ckdpY3M2M3BWNHlnRDJkMktOLWVncFkwMkJodEhhUTdKTGhWN2xqUUdpSXlHYkJTd0U?oc=5
2023 Deloitte Hong Kong Technology Fast & Rising Star - Deloitte,2023-07-25 05:02:48,Deloitte,2023 Deloitte Hong Kong Technology Fast Rising StarnbspnbspDeloitte,https://news.google.com/rss/articles/CBMiwwFBVV95cUxObzVQS2RoWHptZFJBV2JreGZfYVNlSE96a3RESk5ZejQzSGVPMTY5cGtOY0pvQ2dORHBZV21JNkJVbk16UDJOTmlmYUlianA5eDlYQVZIakJYU1JKamcya0l2YnV1OWpKR1F2WlV4UHN0eVFWc0VYR1V6cVA1MGJsZndEai1RWVBpSWFON1RhcTVyb094T2dPSHVEOWhiQndJbzRyWExrS3YtalZGejRDc0FhRFY3dDZzQ3ItTTF3bkZUUnM?oc=5
China’s Ningbo Zhenyu Technology to open battery parts factory in Hungary - Investment Monitor,2023-07-28 07:00:00,Investment Monitor,Chinas Ningbo Zhenyu Technology to open battery parts factory in HungarynbspnbspInvestment Monitor,https://news.google.com/rss/articles/CBMisAFBVV95cUxQUXBXeG1vTkhPazZKbkgtLWhvWTY4M1JJZVFyRUpsWkxLNnpMbUp6YVRMald2ejNWUmtRVGVtQ1AtRWpEcFlKcUJoTFJEb0dGdWhrNG9VV1MwTW9QYnBvSkZoM19tX2RiaVU4Y1RRa2hYVE5yTFY5TVp6VlhXR093T3FaUW5ORnQzcFZha21CRGpoYVA4MFV0bTROeTk1Z2QxOGRBWVFsU1V0ODltWnNERQ?oc=5
Technology transfer as a U.S. foreign policy priority - Oxfam America,2023-07-24 07:00:00,Oxfam America,Technology transfer as a U.S. foreign policy prioritynbspnbspOxfam America,https://news.google.com/rss/articles/CBMisAFBVV95cUxNd05oYzE0SDI2b3NXMUhBRFcyS3lvNHNaVER2cEFwdjVCYkNjVjNnem5KQzE5eTJwbXNUeHpycXlqOW12eWFfcnJZR2FtNjlpNTlSZE1pZVM5VW41aV84bDdXYl9uVjVjWWQ3bG1iUXZ4d052eURGYlR6cldMWEduNFVXYlJGRnhkRlA1YmtxOEtVNGFtOUUwZHRIUDhnMWRJS0ROVjh3NTl3enNMTHNUZg?oc=5
Upcycling of surgical facemasks into carbon based thin film electrode for supercapacitor technology - Nature.com,2023-07-27 07:00:00,Nature.com,Upcycling of surgical facemasks into carbon based thin film electrode for supercapacitor technologynbspnbspNature.com,https://news.google.com/rss/articles/CBMiX0FVX3lxTFAzZlFlN1E2YXRTS2ZOcnZtMjhIMTZvRzctTUFzZG1QZlJEMWg2cmNBT2ZHNlNXT0JGdmxMeTlxdGZWNTQ0V2g3a3lldmUzTXBYdmpuQ1MzNDhvaTJaSlBZ?oc=5
5. Use of AI-related technologies by U.S. businesses - Pew Research Center,2023-07-26 07:00:00,Pew Research Center,5. Use of AIrelated technologies by U.S. businessesnbspnbspPew Research Center,https://news.google.com/rss/articles/CBMipAFBVV95cUxPanJ2NWtNM0hzX2l6S19jN3JzOEdrY0ZySDlVMjl1S3Ezd2Mwa0hsd0VLbHBhZlhsVG1FZ0xtTXIweDBwZVZsWk1QZWNvbzMwbUZVSHc3MDN1Q1FjUFA5WDhuVkJIdUJmNm5WSmFZMTQtVDNzdkE1QlNzc0JnVmdmUW9FY3RRdzNHdkxxSTFKcW1LaTk1cWdsUmh3alEwMUVGTFlxSw?oc=5
"6G: What It Is, How It Works, When It Will Launch - Built In",2023-07-26 20:58:38,Built In,"6G What It Is, How It Works, When It Will LaunchnbspnbspBuilt In",https://news.google.com/rss/articles/CBMiRkFVX3lxTFA2UTJRa1dKaFBLTWgyS0hyVGFwcUY1MXp0VHFaV2lTbEdXUGptdDZVRHZGamRhcmdoUnVoUjFnMXJqMGw0ZlE?oc=5
This new tool could protect your pictures from AI manipulation - MIT Technology Review,2023-07-26 07:00:00,MIT Technology Review,This new tool could protect your pictures from AI manipulationnbspnbspMIT Technology Review,https://news.google.com/rss/articles/CBMitgFBVV95cUxQYW41SWtWY2ZZNmVyaVA3UDNYRXNGVWtTWWFMRXNLLS1wQ0FsdGtrZG1sQldEd3QtRXFHNDVzbmthLXR6T3dOZ2VpZHFCaGJILXpfa0xfVUlINEY3R2w4bmhac0FUdUxVdFFyMlFSalBOay1MZ18yRzB1RmtQa1NQUFZmU1lFdl9qVmdrSS1fNG5GdG92Vnd2VWF4SkQwZXZzUXpmVXIybU1heEM5cDhfcWhpVUJmQdIBuwFBVV95cUxQZ1MzQ0NOdXFVQ29YeW9MYUU1TDQybUwxMUYtN1R6SGx3eTdVaV8ta09HbFlublM4Um85V29CcVZCWjZnVHR4RnBJQnNyclFZVW5aWWI2clRMQ2tFUHJ2UjFmSEduZ3M4UFlEUmpuRVZoUjdNZl9uUnh1bUVELWU4YU10dFlUcXlMVGxfdXhrMGpYNUJpbUlWLTU5NVBzOEhpbXFCMkhNdExkb3JOZHYyTnVfeEFFOXVmTHhJ?oc=5
MEMS mirrors: The next big wave in MEMS technology - Laser Focus World,2023-07-24 07:00:00,Laser Focus World,MEMS mirrors The next big wave in MEMS technologynbspnbspLaser Focus World,https://news.google.com/rss/articles/CBMiqAFBVV95cUxNQlZqMFIyLUcwOVJfejFiS2d6dTlEbHRQOVBmVGtoRTlCOUNHNXN0Mjc3M2dnV2Y1a1VzY3V6T1pEU3hWaXp3U2IyYnJsMUNGYWFjakRPOWpONjJPd2RQaFFPSGVBZTg3V3AwOUVqckh2cTNLQXNmbWJWT2FvM0dxMmhlQzRQTmU4Q280b3paXzhPSGNEc3RJS21DejJaSzB1alZJdTJYckI?oc=5
Catalytic pyrolysis as a platform technology for supporting the circular carbon economy - Nature.com,2023-07-24 07:00:00,Nature.com,Catalytic pyrolysis as a platform technology for supporting the circular carbon economynbspnbspNature.com,https://news.google.com/rss/articles/CBMiX0FVX3lxTFBsSTU0WkFnN3M3YVVKREZybUp1WG0zVTFrZVd0Wk9oc2F1RGtMckp0VkhHRng4NjJrUlBDcC1oaWpTeEdvWExMME9CRW1jSE1fYU1hQVg3WTB1cFlyS1A0?oc=5
UNESCO education report advises appropriate use of technology in schools - UN News,2023-07-26 07:00:00,UN News,UNESCO education report advises appropriate use of technology in schoolsnbspnbspUN News,https://news.google.com/rss/articles/CBMiV0FVX3lxTE9lU1BzWEhqOWZ3Z0c1QlM3UHlFcWk4cTJHUXpfd2ZWNFpyaGMwNUdvUks1bmZXMUJ5NHEzbDBFa2ZYeXpBeU45Z0paamJEWUo0SDA4NTZ0dw?oc=5
"While we wait for the metaverse to materialize, young people are already there - Deloitte",2023-07-27 07:00:00,Deloitte,"While we wait for the metaverse to materialize, young people are already therenbspnbspDeloitte",https://news.google.com/rss/articles/CBMitwFBVV95cUxQRkh4aE5vSWJyNkIxaHZzc3VJdEE4dmN4bEsxOWdTSk1PaWlOUExyZWg5cTl5dTIzQU1XRzA4dy1GMDNneUkzR0RTZmk0VklPNUJxZmhCR0ZxekF4aGxacHZlNWthMnE3QkpUaVpHSUlnVW9rYW9lWTV1U1lPR2pLMVoyN3NrTERBNThvaEh6eUdZSkxCUi1neDlyUjJtMl9VSmlJZGw5Q3JoVDJjQi1GSUVGdmJCSWc?oc=5
Court limits technology use in climate protection case - Brookings Institution,2023-07-27 07:00:00,Brookings Institution,Court limits technology use in climate protection casenbspnbspBrookings Institution,https://news.google.com/rss/articles/CBMilAFBVV95cUxQZDVBRFcyamNqYW5Gc29ORzBleXJYM19qSkE1cmxSR1Blc3F4eWFia2Q3UzNtcTJFRVlUM3dMSTB6OE5MVURubkx3LUlTcldteG9mcEdUMV9QWndaVk5IN0ZJTjdRR2NLZndnS0Q3Z2hPOTFabVBxMW1uTnZpSkI0b3dJZUptQ1lsNnAyaUNrQjYtVTFV?oc=5
"New artificial intelligence-assisted technology is planned to track permafrost in Alaska, beyond - Alaska Beacon",2023-07-25 07:00:00,Alaska Beacon,"New artificial intelligenceassisted technology is planned to track permafrost in Alaska, beyondnbspnbspAlaska Beacon",https://news.google.com/rss/articles/CBMiyAFBVV95cUxNNnZHLXM5dloxSjBwRzBhQUVicFlQbHlIR3ZpWUdVeVFEWThydjJtTEtRR2doMUxEWEdFMlZqMlJZSWdBRlZUbXNDNjVqZGpNd0ZQbHVQUWVCbmRpUWVLV0htS2lma2tIUTZBNWZ3S2JRM0dLZ1diVGtPUmZpUmFxQ2hJSldjMUl6bmJ3dURHVWZlOUFUMEpVbTZLUk0wSDdqWUZzZVJkZGNTMWJYXy16TE9ta2ZMbEhaeVpCa3k1VG0wckRPUTZWSg?oc=5
David Raymond named interim vice president for information technology and chief information officer - Virginia Tech,2023-07-26 07:00:00,Virginia Tech,David Raymond named interim vice president for information technology and chief information officernbspnbspVirginia Tech,https://news.google.com/rss/articles/CBMib0FVX3lxTE5lbm5zejBxbEJYbzRwRDJtWXdBcXo2WjdUaGR2MUhESG1xbWV6Y2tOUE5ZMTlpUTVPT3A5R19SUW5OQVRBamVGQW5sYXN3TldnOEw1UjF6ZVdDWk5QU1NtUmNYV2hBeHRONGlWdDB3Zw?oc=5
It’s high time for more AI transparency - MIT Technology Review,2023-07-25 07:00:00,MIT Technology Review,Its high time for more AI transparencynbspnbspMIT Technology Review,https://news.google.com/rss/articles/CBMilgFBVV95cUxNMWVidkxUTTYydjBWcmFLaWFYTU1DM1FfWXNHUWZuRkp1RW1RRGZPM0tNV09kaVhybzBvVUpWVFBLaGpfWURsMjBrZTA1Q2o1bUpZbTAzeFlrWE5aLVBTb01MQmltVm9sUzlPb1l4OTZ3ZE4zV1A4VUNTbjVfTGFwd2JWbUZJM1FTVWpSXy10MlkwQl80dXfSAZsBQVVfeXFMTm16WlRGY2xRTEs0czRzUGdRVDBIVUs1MU9WcTlzRTFGSV9tME5LaHFmMmxyc1ZFelVObTlmZ1JDMGJwZ0hmeWNOdkRHTjVxaEFaOFNXM1J3cWY5ZkdqRUJWQ01FLThiR1ZjX2dxa3AzekN4V1JCc0VVazVZRnlvRS1aMWFXOU5ZdnE5SXd1Y2NyemYxZjhwcUdqRXM?oc=5
Safe Patient Handling and Mobility (SPHM) - Public Health,2023-07-27 07:00:00,Public Health,Safe Patient Handling and Mobility SPHMnbspnbspPublic Health,https://news.google.com/rss/articles/CBMifkFVX3lxTE9CODQycDV6TFhOUXBEWGduSXBYSkRCUnBXc1hfUUdiWWpqNlBKTHZraXFOemtLMElpNk9adTdLZDR5eFpIRE95X3RXaFk0MlhyZEdYUklfdWFScl91eGFjUFRHdy0tNk1veGRhVTBWUnJUTHhTMlJ3a0ZzMkZqQQ?oc=5
"What’s Working: Denver still a top 10 city for tech, thanks to tech wages outpacing rent growth - The Colorado Sun",2023-07-22 07:00:00,The Colorado Sun,"Whats Working Denver still a top 10 city for tech, thanks to tech wages outpacing rent growthnbspnbspThe Colorado Sun",https://news.google.com/rss/articles/CBMid0FVX3lxTFBSNDVnT19wVl8xbkxrUFZzUzZqX1VyMzFrNVFsSi1xVTBvekpyUXlzVjlQSWNJbi1vOWhHbXhVZGplcVZldTM0bTF4Y0g2QnVpRzQ4WVBsOXRuWEt5TER6TFRDQmdrbEY1ZVRwMVdDQ3lJVDVWZFhZ?oc=5
Avi Loeb’s claims of finding possible alien technology are polarizing scientists - The Times of Israel,2023-07-27 07:00:00,The Times of Israel,Avi Loebs claims of finding possible alien technology are polarizing scientistsnbspnbspThe Times of Israel,https://news.google.com/rss/articles/CBMirwFBVV95cUxQQmo3ZVhNYTFOTFhiMEZWSHZtYXZsbjFVNlpBbG1wd09iVFZKUHVjU29jeVV6RVVpNnRwbnFUZWpyeXFjYW1tWDdUTTduTl9PZm81OGZzTUFNWC15SDBUNmM5ODZ3WUp3Wi1WMnNLMEtrWFdsTlFDZEgzSXV0N09aSEVmRnR1VEJPUldteUg1emZQSWZqOEZyWk1hT1IxNzJiQmdSZVFPYUJOMUNsRXhv0gG0AUFVX3lxTE1BbzVObi1sVGd1ZFNmT29YcUZ3RTVLNUdFYmpYRVpGNmFiZzZiaDNOUEthTWhoOVRNNWpLN0FwckhwUEFjUzVWelhpRnpyUDVSZHNhbnhZb1VsTHNvZ2Rkc2pYZGV5RmpmS0Nvd1ZxQWpSUjhwTFBudndodmRaWEVhVjRmcmJLYkVaUDBHVWZkV29oUDdodUNUS29LSEFmajFvNE5TYnhzU2M0LWMxalUyc1JndQ?oc=5
High performance microservice communication technology based on modified remote procedure call - Nature.com,2023-07-26 07:00:00,Nature.com,High performance microservice communication technology based on modified remote procedure callnbspnbspNature.com,https://news.google.com/rss/articles/CBMiX0FVX3lxTFBpMjZaMmE1a2NST0xSUV9majFiWG10Y3dOOFVfZ3I4UnowSFdxcW9nMXZWWTlzeFF6TkVpNDZRd0RsQXZXQURldWUxcTQzRjNkYnpsSGpac2dFdnJOdmtz?oc=5
Johnsonville Moves to Cloud to Accelerate Automation - Consumer Goods Technology,2023-07-26 07:00:00,Consumer Goods Technology,Johnsonville Moves to Cloud to Accelerate AutomationnbspnbspConsumer Goods Technology,https://news.google.com/rss/articles/CBMifEFVX3lxTE8wVVhrbGRZb3Biem52WHhYOS0tNjA5RXZjRy1kTi1yQ3dmMEVwaHMzU0VMRVV6dXI3N2VEOE51T1R6Q2ZOd0V1ZnpuQXRzSmQtaTZQWEF5eGF6MklscGlsYkxrRnZEV2U4Qk02QkgwVDZMZVlRSWZnUnVzS08?oc=5
Accenture Expands Technology Strategy Capabilities with Acquisition of Strongbow Consulting - Newsroom | Accenture,2023-07-27 07:00:00,Newsroom | Accenture,Accenture Expands Technology Strategy Capabilities with Acquisition of Strongbow ConsultingnbspnbspNewsroom Accenture,https://news.google.com/rss/articles/CBMizAFBVV95cUxQOFV2V3pFRHBFM0dtRzE2NWJWUXBEQl9yMWI3OUNOT20zRF9mTTFMSUF5UGxIM052UURUQ1Rqc2NUcjlJRnpHUElfUXgtb01IanoxQ3laMVNXRjFSb1ZLczNodUZuSy1SN2tucmkwcTdCWV9qTC15TTA3U1M4V3RYNG15YjRXR21RMzE2VTZTUGh2VC00MTdGTGtkN0FELXlLUEVldDBMejVYZjRRRWFabFlyS1FmMkcxWVlBZkIxemZQalpfMm15bTFJRE8?oc=5
"Science, Technology, Engineering, and Mathematics at UNC - UNCO News Central",2023-07-25 07:00:00,UNCO News Central,"Science, Technology, Engineering, and Mathematics at UNCnbspnbspUNCO News Central",https://news.google.com/rss/articles/CBMiP0FVX3lxTFB5LXY1MnJ6Rmlxa3lyMmVvUVJ3U2JYTWx3UjdBT0V4M2xIaTlDejFHTkRvVXBERTJVbl9TaHZJaw?oc=5
#TencentInnovates: 8 Ways Tencent is Innovating to Make a Difference for People - Tencent,2023-07-26 07:00:00,Tencent,TencentInnovates 8 Ways Tencent is Innovating to Make a Difference for PeoplenbspnbspTencent,https://news.google.com/rss/articles/CBMiYEFVX3lxTE1vNDFBUkhaU3YtOWNQWDhYVnM1WjRxX1N3NDA2RU0xVTEzNzI3VmN0WlU3WGxsd0ZJMHVyemlZZk54UzJQT1Zwb0psSnJ3eDBFZEFjUE0tT2ZwZEZVOE9Lag?oc=5
6 most important emerging technologies in 2023 - Telefónica,2023-07-24 07:00:00,Telefónica,6 most important emerging technologies in 2023nbspnbspTelefónica,https://news.google.com/rss/articles/CBMimAFBVV95cUxPYWlZd21COGNnVG5jNUVLM01TWlBKS2t1UEhsQXlyV1pwX0dZdmNaRGc3UFhUdVJfNndFa1pHWmJHaEw4SkRoMUE2Q3NxWlRyN1ZGQmpBdFJkdUhJUGttMmV6YmRoNFRPZUJSdVhnTU5vODZZOWc5N2JPWHBsYVpxVGpKMXlvSjZiOWlBQm01SVhQdHJNWW1NadIBngFBVV95cUxQc0pTdEFLd0JFZnFSQWFmOFNWXzVMUjE2UWlDRWo4SW1YcVhZOXV1UHp4dTVWUE1GMkdVSzFyS05LXzdPZjAtMkJ6NmppVmJJVXhRODlsRjhHWTIzekZSNGNBYlFuaWw4Z0dadkJ2LXNkM0JKZWhXQmJLd045X3A1YlBZRjlnUzZvckxMMkp2V3ZMV19jZGdsR0JyR21SUQ?oc=5
*Press Release* 5 European Countries Have Already Launched Their National Language Technology Platforms - Slator,2023-07-25 07:00:00,Slator,Press Release 5 European Countries Have Already Launched Their National Language Technology PlatformsnbspnbspSlator,https://news.google.com/rss/articles/CBMimAFBVV95cUxPTVRnNnk4VjJKcVhreXV1Mk1xZy1rUEFxSkdCOUZWVjVpejlLOVBXeEx5RHU4YmNyenhUUlhVWE53Yk1Qb3BmSHRzcUlSaUxBMnlyV3NiSURIeWd5RUhsNXNTUEFwUHhhRzZ5OFVJTlZ2OUtTRF9VZS05Vm9EU3NPWlZiNWFHaEZuajhWbjJrMEJVOXFYRU9qVQ?oc=5
Building the biomedical technology of the future - UND Blogs and E-Newsletters,2023-07-27 07:00:00,UND Blogs and E-Newsletters,Building the biomedical technology of the futurenbspnbspUND Blogs and ENewsletters,https://news.google.com/rss/articles/CBMiiwFBVV95cUxQNnNYdkdzMmRQRlNfT3k3clFJSlppMncxcjEzLXZxUGg1TEJwRHk4RjRxNHdrNXpHWEZjSEtpN2o2VHFUUWRjcmtmNl9PcEhyV0tMUGtYS21iYTZqNkFodmgzMXVnQ1pNdkQybmU3Nk9JbzdCR0RUNnBoYWhYWGdsTk5oRWhQOC1ZMTRv?oc=5
ICYMI: “The CCP Will Use This Technology for Evil” – Select Committee Compels US to Dominate Critical Technologies in 21st Century - Select Committee on the CCP |,2023-07-26 07:00:00,Select Committee on the CCP |,ICYMI The CCP Will Use This Technology for Evil Select Committee Compels US to Dominate Critical Technologies in 21st CenturynbspnbspSelect Committee on the CCP,https://news.google.com/rss/articles/CBMizgFBVV95cUxQNDlGMm92VkVjQ05JTmRkQXBoVVlnMDFBY3ZZcmFQc1M1V05lTnp2cE9yd1FiclFvWjNIemd6Wm9mS2hPWlBvR2NERGpqWkY1SEJmTVBvWkRlME9id201WFBZeHM3VFQxbmRULTl6aU40T0lBU25uaWRCX2pwTW0talh5ZndoYnRhY3VCelRqVU9SdnFSemtuN2hwUDlzRHhZa1JZckdMUzZqci1YeTFrRzlwcDkyX3c3WTJfNWtBbktFSkJMaENOOXVnN0JkZw?oc=5
The Insane Film Technology Behind 'Avatar: The Way of Water' - ScreenCraft,2023-07-24 07:00:00,ScreenCraft,The Insane Film Technology Behind Avatar The Way of WaternbspnbspScreenCraft,https://news.google.com/rss/articles/CBMikAFBVV95cUxNam9heDA4RGpBRC1kWEhGbTlSam5aNFZTT2ZfeGJjcGwwWmZUalJzS2p0SzJLenA0M2RDV3d6UmEycndEQzFKQkFMUGpPYnZCWHUwN0xGWEpLYmxaV3V0WGtiYVNIQ0NSS3hpc0NqZ0FOc3RDMUZIQkJuQWljU29SQUVsUGVaOEdLOGZER3daUG0?oc=5
Professor has a passion for digital technology — and German hip-hop - Arizona State University,2023-07-25 07:00:00,Arizona State University,Professor has a passion for digital technology and German hiphopnbspnbspArizona State University,https://news.google.com/rss/articles/CBMipgFBVV95cUxPaXJnRkNMX3h2eVBwTUxtU0ZUMXkzNERkcERiVk1sNjVvTDRPZDl6UVQ4cVdvd2x5QWlHMzFBVkZKOHhxUDRoLXMwVDBlb2gwakZJUjhVOW5Jbm1VekRZYnBvYXNYRjFITTNyVHVOV1ZDRkYwdGc3RFJadDBZek9tN0hCMUR1Z1dMMDZLVE5kbXhJNFZIUUNvbUh5VE1iakdfMFVoX1Jn?oc=5
The Expansion of IoMT Technology Requires Stringent Privacy Protections - MedTech Intelligence,2023-07-25 07:00:00,MedTech Intelligence,The Expansion of IoMT Technology Requires Stringent Privacy ProtectionsnbspnbspMedTech Intelligence,https://news.google.com/rss/articles/CBMisAFBVV95cUxNdVA5MkhsMk1vSGxzeTFOUTlKRFZhY1FNR3FVVWltOVlRMy1zbjF0QTVwWEhoRFBnckk0Q0NHTXprZldCOHVibmNZRTQ5SExmaTJ5dEJESXFOVVFJZk9BNU5VX0FpRWJDeVE5QnpMdmVfSmZXY1FuZ05DNVplWl9NRzRpc20tUDdreTVmMGtWeVJYRDRZMTAtMGk0WVF6SS01UTJrLU9EYlVNMHFZdmhmcdIBtgFBVV95cUxNU1B0TERNckYzX3d0S1NicEFyTUdrT2QyWmw5dVgydFlnckxtV2JfdWVSd3NNeGt0ZjJRT0VDRUY3ZFlxM2NVdGlXRjktbG1FdHYtQ1BocWRQN1ZjbHBxUTZGSkJwOU1RNlhzR2VzRVIyUFBkY2lfV2RRRUNfbTJ4b1dfNU10QzRlM0FHb0hJeHFuUnBOTm9GYXpwUG41SUpDSEZ2VTh2bUkxWWpZVWlyVkxhR0hlQQ?oc=5
5G Technology Is Key to Modernizing the Energy and Utilities Industry - BizTech Magazine,2023-07-27 07:00:00,BizTech Magazine,5G Technology Is Key to Modernizing the Energy and Utilities IndustrynbspnbspBizTech Magazine,https://news.google.com/rss/articles/CBMipgFBVV95cUxQVWlEYXFVYWMzOFZqZGVmS2U5QWpFWXVpN05oR2Nnb3ZpQ1h1UDBMU21FbUlNSE44M3NYRlZ5YnBaZ0ozWElLSmJ2LUJYMHVLZmNtWm1RWS16cFBIUElLdERHZ2E4MzdybFV5NUJncXhMaXN6U1ktTWdvOVpJNUJQb0VrSWtROU95RDZmeVRuYTY1dUZhdTd4b1AtV0FZUnRCT296cEF3?oc=5
DELFI Diagnostics Licenses GEMINI Technology from Johns Hopkins University: Study Demonstrates High Performance for Early Stage Lung Cancer Detection When Integrated with DELFI Diagnostics's Platform - PR Newswire,2023-07-27 07:00:00,PR Newswire,DELFI Diagnostics Licenses GEMINI Technology from Johns Hopkins University Study Demonstrates High Performance for Early Stage Lung Cancer Detection When Integrated with DELFI Diagnosticss PlatformnbspnbspPR Newswire,https://news.google.com/rss/articles/CBMi7gJBVV95cUxQdmh3RDhrX1dDTXFWa0E1OW4xeXVJdW82cUk0cE1ZNm5aUVYxRHFWOGg0QWFrQnhHLWEyQVJyZW01TGk5dnlHUWJLX1ZNMFo1QjlRZ0JBYzAzbXdGb2hlV0pzR1FONFJ3RHRfdE9ZMVdDc1JfLXVFS1FLOFFUR2JFb0xwUlRZUmQ5QkpVelp2dHZVM0VXc0tjeEliZUkyLXZiTFJVVmNXWUNvcmduZVYzdmhmalh3N0hTaTh3Q3FkSkE5LWtQSVNhVDBsVElaSU9qdjJxSlY4VFcyd2M4d0kwczZPaEl2X2FpMVh5WW4wQmFmbExaRS1nQW9oN19ncUl5VndhWEFOdm45ZWFDVWhLTjJXVXFsWk53TVZNN2xuTFI0X0FaSnVDbS1aODVDWno0NFFZOUJTcndfZHlXMXZFSVJHcVNvdG90ZTRhR1h2aS1sU2pIVGVnSlhVWlotU1YwWnBZVFJZTHE4dEdOUVE?oc=5
WMO HydroHub Innovation Snapshot: Introduction to non-contact technologies for hydrometry (Issue No. 1 - July 2023) - World Meteorological Organization WMO,2023-07-25 07:00:00,World Meteorological Organization WMO,WMO HydroHub Innovation Snapshot Introduction to noncontact technologies for hydrometry Issue No. 1 July 2023nbspnbspWorld Meteorological Organization WMO,https://news.google.com/rss/articles/CBMizAFBVV95cUxNdUd4UFpBTUF1dk1uN29uWDdhblN2Wk1xRl9qYmdfTkF6bEsxT0l4YUg2V2VZWUE3MUxSanVLc1FCVnNNSWNtSFZRaVBiV19uZFk5eHZuN0VwUnZmdUF0UXE2TExHYW9PUE5EdVNNNXBLVk9OZ0s5cGp3NF9nY0dPUmQzd1laaGs5eW1hZFpSWVFoN1hhQ2JTS0NUTXc3MkFQeEpiZDE0RG50bXlwQmtRbHQtXzJMRS1RRGpVNFc3MFY0UnR6MEZiQWR0MGM?oc=5
Generative AI and the future of work in America - McKinsey,2023-07-26 07:00:00,McKinsey,Generative AI and the future of work in AmericanbspnbspMcKinsey,https://news.google.com/rss/articles/CBMikwFBVV95cUxPZjN3ck9SQTQ0cTFZS0lPcVBaT01jWE1vVV9FZkc4dTFfQ3RSemkwMHl0ckVFTl8xWkd6akxPSEhYREh2TVhBV0hXVDBGVmw4a2Q3Sk5rTmpRU2VYdjcybkxSbHRYRlBFSC12WnEtWnd3UHQ3NGVRdnZidU1KUUJQczFFX0FWUTgtRERXeFJrTEpGaHc?oc=5
Puttshack Announces Promotion of Key Technology Executive - PR Newswire,2023-07-25 07:00:00,PR Newswire,Puttshack Announces Promotion of Key Technology ExecutivenbspnbspPR Newswire,https://news.google.com/rss/articles/CBMiswFBVV95cUxNNDhUX1V6Y3didjBRanpLZjRCQmkzYVpVTWNHb1ZLM0ZFSFk3ckl5VnYtT1NvQWc2YWVIcFdNVlh0aWl5Rld0NmpGSVg1aU5PZnBvYmFWTE1OaEFmNk1nU2M2Nkwtem83Z2NWdFZWemlTZVN4NUNhNllqaU1RTnF6SlhuVmUwMlNQM2Y2T2tzUThzZEdvR3pzemxGM192a0FsLW51QW1TS280ZUdtWC1pRWxPUQ?oc=5
Payments modernization in the age of acceleration - PwC,2023-07-26 01:14:03,PwC,Payments modernization in the age of accelerationnbspnbspPwC,https://news.google.com/rss/articles/CBMipAFBVV95cUxPN1hNQUEyY2Q5ajZiV0Z6MFBSLU9qVElNU1JUYmU5T0ZuSWo5MWtFWXlDbzRJRkk5T0FsSU03Z3haM09sdzg1OV9vSkFKTzNJYi01M1BLRzJ1d2x2RmNqOG5aTG9CdmZKa1g1d2xKRTFjMlNYMmtRclBpSUJFUi03WHo2ZEVMeHdsLU82RVphOE9iZDZQQlpFTWdqa0l6VW1OME56eg?oc=5
"Comment on NSF RFI on Developing a Roadmap for the Directorate of Technology, Innovation, and Partnerships (TIP) - Center for Security and Emerging Technology",2023-07-27 07:00:00,Center for Security and Emerging Technology,"Comment on NSF RFI on Developing a Roadmap for the Directorate of Technology, Innovation, and Partnerships TIPnbspnbspCenter for Security and Emerging Technology",https://news.google.com/rss/articles/CBMi4wFBVV95cUxNMUQ3MDAtSHZEbEd0R2Y2S2psV1hLd0NpR0hMVVhvV3djamtIWUM0YzVoM202WVM1RDBhUlRpc2x0S0tzR0ZoRVloNExhSFhmU2dXcVotc1JOWXVKZ2JTTDJWWl9Qb0RyTU50Y3BGWjhTWDZ6UDlOLWhnQ0h0OWlXTWtsc18tUHdYOGFWUE1TcVBLOFJISjZxS0Y2bi1Qemt5Wm1PWTVpVWJOa3hSOS1UbE9WSWpBdldjbzZyd29QdExnOWR6anJkYkZHT01GR1JuQzhHMEtuOUFIT3hPa256XzRqMA?oc=5
New Imaging Technology Provides a Quick Look Inside a Human Being - SciTechDaily,2023-07-28 07:00:00,SciTechDaily,New Imaging Technology Provides a Quick Look Inside a Human BeingnbspnbspSciTechDaily,https://news.google.com/rss/articles/CBMilgFBVV95cUxQb1REcTRTNi1MWjFxU3EwYkRZSG04MGhIbUVodExsU3pwenF0bUdFaWNaeWY5VTVpOXNyc0FPSlBvb0Z6d2txOGZVRUxFRWFIMFF0dmZYajFFNWR2c09sSmVubzJOMjlMTG5BUml3ckgyQVRkU3NKR2tBSkFpSEtCQklxYklDQk54UXVTbXJQY3VDNUUtTFE?oc=5
Ask the Rabbis | What Impact Will Artificial Intelligence Have On People’s Spiritual Lives? - Moment Magazine,2023-07-24 07:00:00,Moment Magazine,Ask the Rabbis What Impact Will Artificial Intelligence Have On Peoples Spiritual LivesnbspnbspMoment Magazine,https://news.google.com/rss/articles/CBMirwFBVV95cUxNNjFPQzJmZFhoblFpWDZDSWZKT2ZNSlJ1aXZOcnduZHhIaGVqTWRCVVdWR0NudHViNkdLaF9xRFdaTHhvdXhqZWFOUWlEM0dPZWowTFZPWWFzVURyNlZrX3laMjIwdTdxQ1hUSkM1UDk0cDZLU2VYY08ySVNyWkRKTmgtc2ZvMnE3eC1MSkJTX3Z4ZUd4WHpJTS03NEVqd1RwbWlxcXZzakdTUVd3SnFB?oc=5
AI Vs. Hearing Loss: The Battle That's Transforming Millions Of Lives - Forbes,2023-07-28 07:00:00,Forbes,AI Vs. Hearing Loss The Battle Thats Transforming Millions Of LivesnbspnbspForbes,https://news.google.com/rss/articles/CBMiuwFBVV95cUxNWDNkU0JfUjhQbk5HVk9hcmw3QjFfUm83Si1RTHB3N0k1NFVoT0ZHaGNGSUtTR1JOYUxzbUdzcG11WVdOU2lma2JSTlpKd3pxZWdTUk1IaEd6ZkgtaS1KdldDbEJ3ZGFkajJjdlh5MjdXSmxWTXVkNTB2YTNXWGFYM0RnWXUyaDFqOTZzUmdaRG82aTljQVltRlRoME9vMGdpOFdBN3d4bHNQLUJIM01uNnphSkNfWnBTcVFZ?oc=5
"Worldwide Artificial Intelligence Platforms Software Market Shares, 2022: The Adoption of AI Is Accelerating, with More Organizations than Ever Before Using AI in Some Capacity - IDC",2023-07-25 02:22:55,IDC,"Worldwide Artificial Intelligence Platforms Software Market Shares, 2022 The Adoption of AI Is Accelerating, with More Organizations than Ever Before Using AI in Some CapacitynbspnbspIDC",https://news.google.com/rss/articles/CBMiY0FVX3lxTE1za3UzTmNkaE9mNl9ja0RUUEhTMEJoVGNzU0FKcFUyVlU3Y0VVOG1wV243NmJYSnpQaWZnUERHMjhDQlM0SW5KcTd2dWxqdklmZnVnSWVjVHBLVkgyM180TzJ4NA?oc=5
Artificial Intelligence in U.S. Health Care Delivery - nejm.org,2023-07-26 07:00:00,nejm.org,Artificial Intelligence in U.S. Health Care Deliverynbspnbspnejm.org,https://news.google.com/rss/articles/CBMiYEFVX3lxTE10cmpkMU9ydEYxSlozc19Tb2JSUXVfYTZ1eW45dTQzYWk0dkR6TnEzS1luVHhrVVoxZmFsbDlaNlh6eUlwcjYyYXYyOHdtZkxjS3RvWUlmZnJvOWxobHl3ag?oc=5
Which U.S. Workers Are More Exposed to AI on Their Jobs? - Pew Research Center,2023-07-26 07:00:00,Pew Research Center,Which U.S. Workers Are More Exposed to AI on Their JobsnbspnbspPew Research Center,https://news.google.com/rss/articles/CBMirAFBVV95cUxQX1k2RUYxM1F1QXkza0VQOHBSanpfVjhUQUt4enJzRkxJcUxfZ2tfMFZ1SHBvZVpNVHZRaW94NThNUXhnVnY1dzNMeTdndFRyamlHemM5TnRkSkplVkRCS2pqdWd3bWRlcmhIQUtxbV9LdkxRX2pfdExDTF9vYkhhbTBUSDJGTlppa0sxQU4zc3JmSlMzM00xb0p5YkY0Z3pKajVVbTdRTV9kTmZH?oc=5
AI Caucus Leaders Introduce Bipartisan Bill to Expand Access to AI Research - Congresswoman Anna Eshoo,2023-07-28 07:00:00,Congresswoman Anna Eshoo,AI Caucus Leaders Introduce Bipartisan Bill to Expand Access to AI ResearchnbspnbspCongresswoman Anna Eshoo,https://news.google.com/rss/articles/CBMiswFBVV95cUxPQm5fSElZNFlubFF3NldZQWJtUnpjU3hsLXNfc3R6TlJNelBOUTI5TS03N0lfVVpHMUZCbG9BcTV6eDMzcl9kOF8yYWY3aDdqbE9ZOTJQRFdxT1pwSEVVcllxUGFxMDVZN0c3c2duRkhvTEdYTURlLVNrcVNnbmZ4Y3NXc2J1NndNQVhtNzVhOGpiN0VjcURacml4NklDVFVvYXZQSGZZUkN2TTZSUjlpazlobw?oc=5
From Robots to iBots: The Iconology of Artificial Intelligence - lareviewofbooks,2023-07-22 07:00:00,lareviewofbooks,From Robots to iBots The Iconology of Artificial Intelligencenbspnbsplareviewofbooks,https://news.google.com/rss/articles/CBMingFBVV95cUxQM2JiVWQ2UXphOEo5Zm5uOXhrcjRSRUxJZVY3MUNUZHVWcUxFRER2V1hEOE40Nkkzd2lnclNKSlNYMmczRE1pQVRSX1NXNWxhMklIWHdqNHlFaXFrVC1PR3V4bFFnbzBRUVpLejcwOEtGUE9mcUVnQ2NoN3FLalNjeHZkUEVZc3NXc24xNHZ5TUxINDJBUmZTWU1aMVpuQQ?oc=5
Confronting AIDS in Florida with artificial intelligence - UF Health News,2023-07-27 07:00:00,UF Health News,Confronting AIDS in Florida with artificial intelligencenbspnbspUF Health News,https://news.google.com/rss/articles/CBMikAFBVV95cUxNanJabWhobnNBZldRdDR5TUFjclF3WTVyOGNKVWFfN2pTaEstc2R5cGVKeFlKS2ZrODYwNzBycG5fdUg0VzVGS2pxZ2wwS290dTI1akRtZXdRSXNFRGhBTXpxUVh2TFI3bFB6V2lhdzVTQmpwM3RwOUpOeUp2NnZKcjRCd2Y2YUhnOW9OQlJDWGo?oc=5
Consumer Alert: Watch Out for Artificial Intelligence Scams - NC DOJ,2023-07-28 07:00:00,NC DOJ,Consumer Alert Watch Out for Artificial Intelligence ScamsnbspnbspNC DOJ,https://news.google.com/rss/articles/CBMigwFBVV95cUxQV0UxaFJSdGxTZHN0blRXajNwbGRoU3Ntc3RjMjExMU5DRnVZNTNiSjJFYkZvOThkeFhLUVQzS3k0QWpmdWszdFBsYTAyS1FaQVZYaUttaDdmX2pJbjVGOVpTMWd2TnNJWXk3SUF5aWJHWEs5TEZTTWE5Slg5el81emRScw?oc=5
Artificial intelligence is leveling up the fight against infectious diseases - Penn Today,2023-07-28 07:00:00,Penn Today,Artificial intelligence is leveling up the fight against infectious diseasesnbspnbspPenn Today,https://news.google.com/rss/articles/CBMiugFBVV95cUxPTDhZSEVnYXFDeWNuZVgtNGt1QlBzcEpsTUdZbV96RGF4NGNXZzFlWmFGczhYMzVfMi1tTUJsVWwxcnM0d1RGZmlMWm1uUXVBbXFDSnI1bi15X1dlQzNPUXRDTmkxdGhBVzdwNzJUTXNQWlY0Mk1KemVEb2Z4U0RuT2RZWlZYMkN4Qkk2dVp6VGpMRlEtTkNETUNjNXRqQ0laNUFESGhON3l3ck11bW12VUFoWHFXS2tmaUE?oc=5
Tech Student Brings Artificial Intelligence to Basketball Officiating - Georgia Tech News Center,2023-07-25 07:00:00,Georgia Tech News Center,Tech Student Brings Artificial Intelligence to Basketball OfficiatingnbspnbspGeorgia Tech News Center,https://news.google.com/rss/articles/CBMiqgFBVV95cUxNczNkWkJNTWd5ajVjRk5yVHBOSjBKQTdfeUlVbUszNTV1NVlVaTRFU044QjRleTRaQ3NERU56LWY3TTU0Y0FNbzc1U2hoWDNzUVNGUUJJZF8zY0JERFI3TDVGbFdfTXczaGV4by1OM2NSX0s0SGtLMk1yUGE3R2J0cFBqMnZUbkhRMUpoLUR6N1Z3NFEzamhrQkM2SnJIRnBMVHV5ZTBlZjZEZw?oc=5
